Comment_ID	Text
z13dv1kb1vm2i1q3423ahrdgvxmpxvtnx	Liberal (that is of the classical tradition) people are willing to give others the liberty they expect that others will give to them.<br /><br />History shows, and the modern European experience with Islam will show that Islam is not willing to give others the liberty that Muslims expect others in Europe to give them. Islam is not an honest counter-party to European civil discourse, nor to European refuge. Islam will soon start to demand that Europe give concessions to Islam. Those concessions will turn into demands and those demands will turn into a demand that the indigenous peoples of Europe recognize Islam as superior. <br /><br />Islam is colonizing Europe with the attitude that every single thing that Islam touches becomes the property of Islam, and that a Muslim would rather die than to give it up. <br /><br />Europe, in its generosity to Muslim workers and refugees is committing cultural surrender. Up until Hitler, European nations would go to war and had gone to war to preserve their national identities. The atrocity of WWII shocked Europe to such an extent that it appears nobody is willing to fight to preserve any of Europe, except as a giant bureaucratic state. Just wait until Islam threatens to have too many votes in Brussels. <br /><br />Europeans are starting to wake up to this slow motion demographic train wreck. The only way out is to suppress Islam in Europe, a process that will cause the shedding of blood. Islam is not compatible with Europe or any other continent it resides in.<br /><br />Wake up America
z133s5bwsyrizh14n04cerdwey23wj1qowg0k	if anybody hasn&#39;t yet figured out Saudi Arabian terrorist did the 9/11 attacks had nothing to do with Iraq but they were Radical islamist. when it comes to talking about it being an inside job I do not have facts on behalf of that so I will not mention or talk about that since I choose to live.
z13pxbjzut2uwryis04cgrjqnwuphx2ij4c	Here in UK we have no choice the Liberals Control everything  even what we eat.You could Be eating Halal but you wont know.USA Dodged  Disaster with TRUMP.
z13ujdcg0wumdfi1523byl5qqxj4gppm0	I 🇺🇸LOVE🇺🇸 THIS PRESIDENT‼
z13dfp4o2r24e5nao04cdlr5kmneudkalqc0k	Trump supporters and Cliton supporters hear me when i say start preparing for an economic crash. Our enemy is not outside our borders but within. Wall street is gonna create a colapse and blame it on this unlucky dumbass Trump. Trump doesn&#39;t know he&#39;s being used as a puppet. Start preparing my Friend&#39;s and don&#39;t say i didnt warn you. Good luck and may you all be enlighten.
z12fzjnqmwyqfrdwo04chzcwhvryxjjhjvk0k	How come he didn&#39;t ban saudi arabia..hmmm... oil oil oil..
z12lwxorpumvyvb1l23tslmy3ou2zp1r504	i am not american. i do not live in this country. but by god i love the fact that the president took actions to wiped the virus out. the few days he has been to power he has been doing what he said. words and actions. the other were muppet shows with only words no action.god bess him to rebuild usa again
z12ohrmh5wvqsn2au04cfflyclerdfzitro0k	He protects us americans thats ALL....... And that is who needs to be protected. Cnn can move to Iraq, Syria, Iran, Pakistan, or Afghanistan. No true patriotic american will miss your bullshit news.
z121dhr4zqjesxzvk23nfvxbcmazcthec	Mr. President, Mr. President, don&#39;t you believe that these lawmakers ought to be arrested for separation ordinances? Isn&#39;t that illegal and wasn&#39;t it made against the law decades ago? Why haven&#39;t these law makers that are not cooperating with your executive order regarding the new immigration law not been arrested yet for defy the United States law b/c they are committing treason? In the ancient days Mr. President this kind of crime would constitute off with their heads for such disrespect towards our president and the law of the land or they would be exiled from the land! Why has America become such a pussy, Mr. President?
z13rvf1yupmhcltuu22qtzyxwverthrm2	I&#39;m tired of the Dirt and Fifth of the World, Believe Me.  Also, I can&#39;t listen to CNN, they are lying when they open their mouths.  I will see other media on the signing.
z13vtrijwpyfv1twv04chtspsuvusnpadnc0k	How many of the 911 hijackers were from Saudi Arabia? And why are they not included? Trump is a PUSSY!
z13sevvqzrv3cnnqi04cf5z53yvevbdrzb0	BUT NOBODY NOTICES THE PENTAGRAM BEHIND HIM THOUGH...
z12xwriixyfuuz5xp04cetdgpvzifdn5s2s	FUCK ISLAM
z13vut2okv23hl4oc04celxx4qeuutsoxjo	press the button Donald. give life a chance.....USA USA .....O DEAR
z12ts5ywnnintbo3i223u5zolo2owx5ti	nope trumps punk ass better do what we tell him as citizens and build that wall,we don&#39;t care he&#39;s president we just gotta stay on his ass about it.
z13ww5fgcvztxz43x23szxwhyoykx1ofe	funny this turd HAD to throw out &quot;in his view&quot; rebuild.<br />I wish I could knock the fuck out of him.<br />this is rebuilding
z12afhc4zvmzx3zjv04cgdoxgxuagztbjos0k	Haha he said &quot;call of duty&quot;
z135zhba3qe5jfyxz04chfby0yymydyy1go	If only Europe would do this
z12xwrarilbafvpv223uzhlaivzpvttzg04	darknightoftroy, gay marriage was forced, if us preachers or pastors don&#39;t marry them , they can fine us , pull or marriage licenses ,or put us jail ,or all three together, sounds forced to me . they will just have to put my in jail because I&#39;m not going to marry the same sex , it&#39;s a abomination to God, and that is not being racist either, you need to know the facts , so of my pastor friends have all ready been put in jail for this bunch of Bologna.
z130vt2a3xjksh1go04chtfqoknlw3d51ss0k	Where were all these liberal &quot;philanthropists&quot; when Roosevelt ordered for the Japanese living in America to be detained in special camps during WWII for national security? Why the sudden change in heart for the Islamists that are being banned from our country? Why their sensitivity goes towards ESPECIALLY the islamists/muslims?
z13tejyyayj4trabj04ci1yprqnritlraqc0k	Not &quot;radical&quot; islamists. They are Islamists! All of them believe the same way. There are millions of sleepers. Their political ideology tells them to deceive us. Dont let them.
z12lt1dr1kzydxopn04ci5yxgrnxz1s4u0k	And, let&#39;s get going. God bless the USA.
z12efpjqsnvruvco004ci5qqqzakvnvqqno0k	<del>SAUDI ARABIA</del> NEEDS TO BE ADDED ASAP !
z124xxlweli1xhdyc04cfvsgoofouvjgc24	Now thats a perfect presidential decision.
z13ys13xfprafhapj04cgdvpupilxrfypjw	0 Americans were killed by people coming from those 7 countries, he didn&#39;t even include Pakistan and Saudi Arabia, I wonder why?
z125ilcyzrfxhznjq04cdp0qlp2vz1cbado	Lets hope Our PM will follow suit, its time to do so, sooner the better. Lets get tough !
z12zyjfp5vzzjrxgf04cgfbq1sbihb0b2gw	Damn... Lot of racist people in the comments.  Well what to expect right?
z13hgpz4vra3yfmq504cg3mbvxn0shwjmbo	wait mox news?? lol fuck your donation
z12kvvkhlvuyczpwt04cddaaawa3d3ra5lk0k	funny thing is the none politician doing better job than the one came before lol
z12xs5mrrwfiyv10k234vfabbnbnufy4v04	BUNCH OF FUCKING GOBSHITES OF THE HIGHEST ORDER ALL TRUMP IS DOING IS CLEANING UP THE UNITED STATES MESS WITH STOPPING IMMIGRATION FROM COUNTRYS THEY HAVE DESTROYED IN THE PAST WHY IS IT YOU WONT TAKE ANY YOU FUCKED WITH ALL THESE MUSLIM COUNTRYS YOU DISPLACED SO MANY PEOPLE YOU CAUSED LIBYAN WAR YOU CAUSED IRAQ WAR YOU CUASED SYRIAN WAR YOU ARMED THEM UP WITH WEAPONS CLORINE BOMBS AND YOY EXPECT EUROPE TO TAKE ALL THE REFUGEES BECUASE OF AMARICA FUCKING SCUMBAG YANKS THE WORLD HATES AMARICA AND FUCK YOUR TROOPS LET THEM ALL DIE IN WARS THAT YOU START SCUMBAGS .
z13cerhyisjuxz4pa04cixqg3qqxy5bbeqo0k	thank you president Trump
z130fr1qtrfsfvj2122xi3v5mxvaejr5r04	Thank God for TRUMP!<br />Another great day of Donald delivering.
z13vzbqh1vbwdjmhl04cjrwjywj0gvdyqyk0k	The last point they anchor tried to make was retarded...
z12ofnzgwyn4yvzmb23rxjfb0kbxjhyln	yes. fucking yes.
z13aip4zrm21yvpsx23cuhmqpxmmsxijp04	now let&#39;s kill some rag heads!!!
z12fhhyqitiihb1qp04cjd1q3uamzvw5rpk0k	Erase ISIS now in the face of the earth!!!
z13au1tjsprfulazh04cjjdqkr3qtppqdbw	Keep working Trump! Very productive job!
z13thfczwtrxz1uyl04cg1i5inj2djfxwc0	trump bout to run the whitehouse with major balls, grab them by the pussy. don&#39;t fk with usa
z13exhbroonvhns0b23kctmalyvqspklc	Prime Minister Trudeau in CANADA has told all of these fucking RADICAL ISLAMIC MUSLIMS TO COME TO CANADA. WE WILL LET YOU IN OUR COUNTRY BECAUSE OUR PRIME MINISTER IS A FUCKING STUPID COCKSUCKER !!!!! FUCK YOU TRUDEAU! !!!!!
z13lfxjp2mfkevzkj22mwvnoykuefzn5004	I am happy no one of those coming to USA and should not USA citizens go there too.<br />thank you Mr Donald Trump I love you.
z12ovvjyip24jrsac04cfnazrkybw3ogvng0k	All immigrants and refugees from Syria, Iraq, Iran, Sudan, Libya, Somalia and even Yemen are barred from the USA, yet Israel  Saudi, Pakistan, Egypt, Turkey, UAE are not, and it&#39;s simply because he has business ties in these places.<br />Saudi crucify it&#39;s citizens, chop their heads of and drown them, and they&#39;re slaughtering thousands of Yemeni as I type, yet Trump thinks that&#39;s OK?<br />Does he realize that there&#39;s thousands of citizens from these banned countries living in the USA right now? Trump&#39;s a bad man, and I hope he impeached ASAP...
z12mizbwxpa3hz53q232zh35tp3ltrdfr	You sell weapons to both sides and sell your wars through lies! &quot;Thou shalt not kill&quot; and you are doing it for financial gain and lying to get us to volunteer to die for your empires! People see the truth. STOP FRICKING MAKING MONEY ON DEATH!
z13vgzwg4oyfcz3dl23wcvowjxrptth2c	Even rich islamic countries like Saudi Arabia, Dubai, Qatar doesn&#39;t accept immigrant &amp; REFUGEES from this countries.
z13uyn5xctmxcdjdw22iirqqgmqwydtq404	Eww. CNN. Bye
z12tc5uw4u3dej3jd04cj1bbnnaadpjrri4	President Trump is so wonderful finally we have someone that is not doing the same old thing.
z12mffyw0sfhgxdgw04civjjyk35yvqb3tg0k	please stop the chinese next !!!
z13gfr3bvy3wwljmd222gvzq0le1zdlcr	I&#39;m not saying America should continue being potential reactors but what this man is doing I&#39;m pretty sure no other level headed republican president would do this, what have we done to get this guy?
z13jxrfgkrqrcrq4p04ccp2iwsystz4y1ow0k	was loving this video until cnn liars started talking . Boycott cnn they are a enemy to the country really . straight up propaganda NWO puppets .  so disguaring
z133cj0qtmadwx4kq23iyjm5ok3itppqh04	Funny how those countries in the ME who back train and fund ISIS are exempt from the banning.
z134g1kqsompebrik04cexhgskzudx5r1no0k	Hahaha this president is a joke. The return of Hitler.
z123txmirymbhr3ad04cfvyw2rb5exezrxs0k	WHAT IS SO ADMIRABLE ABOUT SOME COWARD WHO  WAS FIGHTING SOME HELPLESS AND POOR PEOPLE WITH NO SHOES ON .WITH THE ENTIRE NATO FORCES ON HIS SIDE YET STILL LOST THE WAR.. AMERICAN SOLDIERS NEVER FOUGHT A STRONG NATION OR STRONG ARMY ALONE.
z13ghh2rdtjndvhsy23jyx1yaxq1gdyfd	Mike Pence: Call of Duty
z12rhvupnrbof1bhz04cgvt4pl2xth5h2cg	one men with balls...not like Obama pussy...
z13gjlrzysyadhkpi04cepygovqviz3pkh0	GET EM TRUMP!
z120i13yfuq2ivas423vff1zpzirhzdgh04	unite Americans
z13hcz0hcsaafzfs522wchkbauaft5lfm	HELL YEAH
z134chez4lz0jtp5a04cgrtiiwigtzgpal00k	So I wanna bless him .... ????
z13ddjrpuqnwzh5vj23us1awsmbjs3zyj04	long live president trump👍
z13strbypnntejmg004cdrrikqrxi5wjovw0k	Great news !!! We are all being invaded in europe. Sweden and Germany are in a terrible mess.
z12kjrc5ly3pvbbnt22sinepxlr2xpmdo	these refugee arabs n persians should stay in their countries n kick out ISIS. Great move by president trump
z134izvy5yr1sjyx504cezggruqmfz3q1t40k	THATS MY PRESIDENT!!!!
z13dsxrpvvvutnrx404cfh1zamyog3zox4o	You may be seated! That&#39;s Liberty right there.
z130ef3zws3nf3mip04cin3poyr1yr4xqmw0k	Trump says  &quot;We dont want them here&quot;.  Im pretty sure the native American Indians said the same thing.
z13kgvighnr5hrh14233hrmojt35jfk2i	"Re-elect Trump!!! <a href=""http://www.youtube.com/results?q=%232Terms"">#2Terms</a>"
z12wwlhwjs2ts3bqv04cjplr0xaacbjwoo40k	TRUMP
z12jfhcwcvbxwj2ra04cixdiruahe5epgyw0k	Islam must be destroyed
z12qevyydv3ej1eur23ah5mqakifhtobe04	can someone please save me and coutnless others this pain and please reply to this comment with the list of countries?
z12ivz0gfn2vu5sqd04cedsryvvchbrza3c	Is Pakistan in the list of those countries?
z13wi31gcqfxt55bd04chjciblbphjjjbvw0k	it&#39;s a rich man vs poor man thing ....not White vs black , cause both are smoking crack tonight
z12hylojtsv0ulbzc04cilma4svyvt3wf1c	If this were true then Israel and Saudi Arabia should be banned well before anyone else.
z13gwvyarrz5z3gdk231fd3x4znxglysr	Saying islam is bad because of isis, is just like saying christians are bad because of the KKK
z13xyzljjn2ws55lr22rybkhwtmsytzyt04	China and North Korea and Russia and Iran and terrorist-pukes better back off, or we&#39;re gonna getcha.
z13eu1sbyzicebfqg04cdlsrexeufrnroxw0k	Im so happy that im NOT american! Good Luck stupid american People!!! Wait for it!😆🎉 yuhuuuuu
z121grzbfzn1ghfws04cip4ijn3rwv4ww14	Have you ever seen anyone holding a severed head that was from a religion other than Islam?
z12yu3bbhna0hvusu22cjhqpzumsexe4f04	Have I died and gone to American heaven?<br /><br />Seriously, I have never seen the US government put US citizens first as much as Trump. It&#39;s wonderfully surprisingly surreal.
z122vpfrpsaoir1nv23ku1rzjrb2jvoq004	drumpfh is a nazi,  who would have thought
z12mzlcyoke1s1ou423sgtpqgl3lixu23	thank jesus christ himself for president trump.. he beat 16 niggers then 1 tough courrupt nigger bitch go trump president
z12exxzacyque5iik04cjvpanuugdjoaoco	TRUMP ROCKS
z12jgfkzgrj1ebf1n223enz51rrnvdlwt04	Who is breathing that loud, they have a serious problem?!?!?!
z13tijyppszafd1ff22uwdrxyyvzif2vs	This is almost too good to be true.<br />But, Hooray. After watching the muslim destruction of europe---RIP, this is absolutely the right thing to do..<br />WE should even do more by deporting the muslims that are already here. The muslims hate us.
z13azphhgwa4zpmx204cdftbfrj4fncry2c	Dayum,each and every campaign promises comes to fruition...that dude is for damn real...geez
z12luv0ryrn4fpnhf04ci524kxekg1chdeo	Three words liberal savages hate: ☆TRUMP-PENCE ADMINISTRATION.
z12get4qiqqmtxgwf04ce3m5lnz3cr3qs0g	Thank you to Mr President nice job !!!
z12htxzrjwvhwhtq004cjprilyz4ypzwewk0k	Trump needs to ban the whole middle east then, no way to keep them out. if I was a terrorist willing to murder hundreds of people, pretty sure I could cross a few borders and lie to my enemies
z13oebih3vblv5ll423he1z4gnjhgh2h504	As a Navy Veteran, our military is the best ON THE FUCKING PLANET!! HOO  FUCKING RAH!!!
z130ipzo2zepupugx04cffvpqv2aehwzir00k	This guy has done more in a week than Obama did in 8 years!!!!
z13cwzj55pv5y1pm1225tvghfq3hftzfm	hahah excellent
z12cjp2jhpuvt33fs22ot3ahunexx1bmn	Fuck you guys, now we are gonna get all of them coming to Canada!
z121dpqb3yb5hxiy504cflkhgku2ibybtvo0k	wooo hooooo!!!!
z13wfzij4yjjgxhto23qyz0akvamgx4ae04	President Trump, please ignore all the cry baby &quot;progressive(socialist)&quot;. They have had their run on this Country for the past 40 years! Move forward with getting this REPUBLIC back! Anyone who want&#39;s America 2nd and burn the Flag should be escorted to the nearest border!  Never to return!
z120xbfy5ximwx25w04cfzvz4yipw1ezdjw	Amazing...I think I will enjoy this ride.
z12xspvbnknnubtnw22mz3j4dnfhvtx5404	Good!! Now we can start deporting the ones already here.Drain the swamp!! Dig a canal, install a pump, bleed the swamp BONE DRY, shovel it down to the bedrock, fill it in with gravel and pack till it could withstand a nuclear blast. Make it so another swamp can&#39;t develop.
z13ug5uh4vnlht2up22utndiwvzxg1d4304	He sounds like Elmer Fudd
z124ixlgfreyids3z230crlimku5tvw5r04	say what you will,  but he&#39;s been a man of his word...
z12jxd1zcufxgpbll23pxp3pxqbpcp4yk04	PLAIN AND SIMPLE...... TRUMP IS PUTTING ALREADY U.S CITIZENS FIRST.. FIXING THE HOMELESS POOR AND VETERANS AND PUTTING THEM FIRST BEFORE LETTING MORE IMMIGRANTS IN!!! I AGREE 100% WITH ALL THE TERRORISM GOING ON THAT&#39;S THE 1ST REASON NOT TO LET ANY UNKNOWN POSSIBLE TERRORIST IN THE U.S.A ... whoever is already a LEGAL IMMIGRANT IS FINE AND THAT DEFINITELY MAKES SENSE!!
z12qgxqoszjkcn40h22ly3wwjqmkglb3p	you are not American,so you are dictators, this is tha land of Aztecs,you are not an American,go back to Europe!!!!!
z13wu1hyhmqmgrsqx04cf1poms3mw54yvr00k	Thanks GOD TRUMP AND PENCE UNDERSTAND very good the BIBLE JESUS CHRIST The one die on the cross glory to god forever one nation under God no under Rome
z12gil0xwwiyxf3hc04cdrph4ryejnq5wtk0k	Obama did nothing 8 wasted years, just abused our country. Gave it to the world to do as they wish.
z134ytwgbofxybvly23xjxniblfgfn1wv04	WORTHLESS! the eo, banning 7 muslim countries .... sounds good, but is worthless! First, all the immigrants the EU are dealing with, they have no idea what country they are individually from, they have NO IDs, so you ask them where are you from......, and why is it that Saudi Arabia, UAE, Egypt, and Lebanon, are not included? This seems like a show..... wow, very disappointed.
z12md1wzgwupjj4mu233ubv4mue4ilems	Bravo !
z12rdxd45myhhhkm423mhpbjzs2bvr4bw04	iam keeping my name from being out there
z125idujfxmidxsyg04cghminpvtx3gipes	enjoying the lolz since America turned into an idiocracy
z132xdk4mxe4j1ltl22ehfaxtquli3ubz04	does Trump really believe that 911 was committed by Muslims? He needs to investigate Building 7, but he wont.
z13xiri5otedylvga04cg1qrymbcenog3ds	as an immigrant who is anti trump, i have no problem with this. i think this might be a good thing he did
z13otpeigkumc51at04cdnwrxu3ugtibimg0k	Hi everybody out there both on the left and the right.  Our new president has moved quickly to institute certain changes that he has been wanting to make.  Me, I lean right, and many of you out there lean left.  Neither of our opinions means anything at this point.  I do not applaud anything he has done yet except that he has certainly gotten busy, which is what we hired him to do.  As far as the results go, well, that remains to be seen doesn&#39;t it.  I suspect that he will have successes and disastrous failures.  That is how the world works.
z13qgtp4mzeshbnsw222sb4gatfvjrmpr04	Fuck Donald Trump
z12ke1kjnknzfjmb104cdfsj5obad1y4es00k	How about sign an executive order to give this land back to its original people. Everyone except natives are illegal immigrants, this land was taken by criminals
z13hwxtq0oycitmzg04cgnlihxm3jdqyac0	🙏🙌🙏🙌🙏👏👏👏 , Thank God
z12gcnwbcwuydpsxn04chtzp0ruktllzecs	Finally we are on a level playing field to stop terrorism.
z12ny1qohrf2ittp404ceb1xbrrzfzejm30	Thank you Donald Trump!
z13iffvjmzy3znlaa04cfzqy5virhrtgas00k	This is fake news
z125jffw3vj5trvkf23ejpuj3mz3uhkno	so trump does not want Muslims in the USA ?
z13djfdbzq2ccdztf22ochtanyrwuzzjq04	Ohh I forgot and overweight fat Americans - they definitely need rounding up and putting into &#39;camps&#39; where they will rapidly lose weight. They are the ones eating all the food and draining more of the worlds resources because they have to have huge clothes and use more fuel to move them about.
z12hhx0ibwiwhtc4z04cjxdwfsysc5iwqmw0k	Saudi Arabia is the biggest supporter of terrorists. And not  on the list. IDK SEÑ.TRUMPOWSKI...
z13rul2rgqv0ftcpg04cjvkjhyardjbrcvc0k	FINALLY A PRESIDENT WHO USES SOME FUCKING AUTHORITY. Good Lord.
z13kszph5oestlvcd225ufth2m2vvfzl3	Let the dogs loose.. Go General..get im..
z13bxpo4wneqdvlgt04cfhih0se5uxvqzes	well done donald keep the muslim disease out of your great country now cleanse the rest out as they are too backward to exist in your great country
z13vcz2gktvgh3nfo235wp0wez3wtr2lo	wow. proud of trump,  he is really a men what he said he is doing it right a way. God bless up man.
z131s3oitwigvblkr22heja5byzjcb4va	these arnt the country&#39;s that these terrorist are in in lol drumpf and his supporters are a bunch retarded inbred pussy cousin fuckers.
z13rzr4o2xfacbxo104cjn5gqsr0hxtwero0k	who else is not from AMERICA but sees and is proud of our world leader ,, TRUMP
z121cjshdtbohd51g221ixvillbfjv2i204	The mad dog is the champ in our Forces!  Brilliant choice by President Trump.
z12ucrwijozfh3tie04cgrmoeufaidsxucs	General Mattis! Oorah!
z13ewrcatw2ftx1px04cjju43rrjvtg5pgw	Well Done Trump. You stop your enemy by being strong, not by being a complete libtard.
z12zfbozomfcxxx4x04cf3uozsyvxduqaw00k	ORDO AB CHAO<br />ORDO AB CHAO<br />ORDO AB CHAO
z12yylixvse5irjxy04chtc5flyhsj3z1xk0k	lmao look at these CNN guys lol! nothing good to say still... pathetic
z13bip5awr3pi1qfa23zezkb4v3djdh2r	One dude claps...the rest of the sheep follow. Do as you are told sheeple. He&#39;s not very presidential but then again most americans have been spoon fed an image that has been carefully controlled. Every word scrutinized. Every blemish erased. Not happy about the impending rearmament of the US forces but what the fuck do you do when china starts grabbing land way the fuck out in nowhere. China controls your purse, manipulates and steals from you while you fight wars that they do not give a shit about. They pray to the money god while you die
z132s55wmpb2d1omx22ienoiyuypwhnna	so what about the good Muslims??? do they just get fucked over or what I mean I understand where everyone else is coming from but still what if you were in thier situation I mean you guys would try to seek shelter too right?
z12bgnaioy31id0vy22uwvd5xomsy3hqr04	he looks so fuckin fake
z12xvl1aeuvgt3xud220znd40xbgsjxfg	What a bunch of bull shit.
z13ffbraayjke1ck223wt1njtrybwnhcr	We are a shit show!
z12kvthxsub2zhrqz04chxa4evihvtixczw0k	The very next step is to DEPORT from the USA all Islamic devil worshippers making sure they take their Nazi ideology and rotten Moon-god with them NEVER to return!! In God we trust - not Allah.
z12tidcrvnrscnfag04cep4qrpfdwxprvvk0k	Finally, a president that does what he said. God bless President Trump.
z135fbmbenywetg1022vzb1obtydfzyfd	MOST IMPORTANT AND EFFECTIVE WARS, ARE FOUGHT IN THE HEAVENS, DANIEL PRAY , AND TWO WARS WHERE FOUGHT AND WON, AGAINST TWO KINGDOMS, WE OUGHT TO PRAY CONSTANTLY, SO YOU DON&#39;T LOOSE YOUR HEAVENS AND YOUR LANDS., BELIEVE ME, THE HEAVENS AND IT&#39;S KINGDOM, IS BIGER, OLDER, AND MIGHTIER, THAN THE EARTH&#39;S, STAND BEFORE GOD, ON FAVOUR OF YOUR LAND, AND YOU&#39;LL NEVER BE DESTROY., IS VERY HARD,  THE ONLY WAY, AND NO SHORT CUTS. PLEASE GOD, DON&#39;T FORSAKE US, NEVER PLEASE.
z12gffia1oq2f3oi004cc3gwdwm1cjl4ba0	This is just incredibly stupid on his part and the government for allowing him. + the supporters who actually think this is good. But okay!
z12ccheyryj4jntyq04cfdtrhqfnzxswbrc0k	yesssssssss
z13rvfcq1lezhht3t22kvdc51rayel1gz04	Hell yeah, mad dog mattis in the house....one of his quotes...The first time you blow someone away is not an insignificant event. That said, there are some assholes in the world that just need to be shot.”
z13nfvobtrntuzjyz04cf5bropv0g32pmdk	Holy moly - another promise kept!
z122xnbbvrfksv2an04cifzggy2whxgbdk40k	Finally an American President who cares about taking care of Americans first..!!!
z13iwrmq5vqdsle1v23lhto4lu2ltbha404	Donald Trump he look as a pig
z12qcxvq2k2zhb1kn22zfzhasqizfn1xn04	Trump is making america better, people who hate on him are idiots. I am not American by way.
z12lyfhijvrfx15pz04cif44jkvyurjx304	does trump ever change clothes?
z13mh5ngevilupbgd04cen5hcvbdd5j3e	What countries specifically?
z124vviirkfrg34g004cdp2obnevybiwxzc0k	If you&#39;re an old fart like me and live within say 40 miles from the Mexican border, you could sneak in a few Mexicans every day in defiance of Trump and his intolerable edicts. Because of my age, I sail right through the INS check point near Tubac AZ, and the agents barely give me or my vehicle a glance. I could see having three or four Mexicans in my SUV covered with a blanket and no one would be the wiser.  How would this tyrannical president like that shit?  Ha ha ha haaaa   har de harr har harrrrrrrrrrr
z13mtfagmsytydioo04ch12wbrafhxfgr2k	HAHA FUCK U BLACK MUSLIM SAND NIGGERS
z13wjleaumbdspqkm22pjj2h1lbkcv0tt	Trump goes as far as hitler
z13jxnmovujkfpywc04cj5nypxa1wb3ghjs	so happy he is our President
z12xjbhiosq5vrd5a04cj5wqzsj3cdegyoo0k	Im so excited about this Presidency...I love President Trump!
z13eg3ez3r2dgr4mg23ienbipy2kgxohu04	&quot;Believe Me&quot;
z12bghagxricxvfvr23jeh3iftnhctgh304	Trump is a stupid looking President. This President make Americans look real stupid for electing him,
z12htv1olwu0t1yug225hfrafqnpchiah04	For 30 days.
z12rdribwwqmczcn322yifdgtkietxsh104	its like the chinese back then but now towards arabs lol
z13cyfsiiln4ddf0g23bd3vhttjfyzxgm04	my fucking English not enough . after that if any American living in any Muslims countries a round the world and the police put them in the jail I think this is the way
z13kjffyiw2ltnx2c22fxxmxqoejc1anq	BULLSHIT  CNN!
z12syrzxdsicf3xpm04cgt3p0om2xvfov4c	No Saudi
z130j1jhyki0u3m1p22vgdxqrpiowndyz04	"<a href=""http://www.youtube.com/results?q=%23TeamAllah"">#TeamAllah</a> all the way!"
z13ndnxg0orouvak2235urmijlvcuhmws04	Trumps gettin to work! Eyyyyy
z13pinyxlyu5etlcf22zhrbgwx2xufbpi04	where did ali go? hahahahahahahahaha
z125j1a41ziqzj45n04cc1iyznamtrohhe0	Mr. Trump. You are a great president who understands the threat the radical Islam poses. - love from India.
z133hr5grzjsuh10i23qhfpzqpv1xdhb104	I have a green card what does it mean?
z13sdrpydlzdgnscc22fcnqbgryaz1kgw04	Fake News I see CNN
z123j5kgas2atn2x504citmj5ufyudcgbm00k	HOW ABOUT SAUDI ARABIA? THAT IS MOST TERRORISTS ARE! IMBECILES!
