Comment_ID	Text
z13rgfei4xeudjesh22cenlqpnjaz5y4x04	any one taking this bullshit serious is a uniformed fool...these fuckers are the real terrorists their that dumb their fooling their own selves
z12idjvyao3hzlizy04cfh2jsuehctuq5a4	Someone has to start it, good work
z12ztjzxswqczn3hi04chpcbwlmhxplodoo0k	Be careful what you wish for Trump dickriders....I love how some of you have forgotten what the statue of liberty holds in her hands. At some point in history your family sailed right past her....REMEMBER THAT!!!
z13ccpcocqiexnjsq23ocpjgrqezx5r14	Didn&#39;t obama ban Iraqi&#39;s for 6 months.
z125zleotkenivinz22bcn0iurnnefqxp04	welcome to ww3 as predicted by albert pike it was originally published in The Mystery of Freemasonry Unveiled by The Cardinal Of Chile in 1925 and was a letter pike wrote to Mazzini, dated August 15, 1871.<br /><br />“The First World War must be brought about in order to permit the Illuminati to overthrow the power of the Czars in Russia and of making that country a fortress of atheistic Communism. The divergences caused by the &quot;agentur&quot; (agents) of the Illuminati between the British and Germanic Empires will be used to foment this war. At the end of the war, Communism will be built and used in order to destroy the other governments and in order to weaken the religions.<br /><br />The Second World War must be fomented by taking advantage of the differences between the Fascists and the political Zionists. This war must be brought about so that Nazism is destroyed and that the political Zionism be strong enough to institute a sovereign state of Israel in Palestine. During the Second World War, International Communism must become strong enough in order to balance Christendom, which would be then restrained and held in check until the time when we would need it for the final social cataclysm.&quot;<br /><br />The Third World War must be fomented by taking advantage of the differences caused by the “agentur” of the “Illuminati” between the political Zionists and the leaders of Islamic World. The war must be conducted in such a way that Islam and political Zionism mutually destroy each other. Meanwhile the other nations, once more divided on this issue will be constrained to fight to the point of complete physical, moral, spiritual and economical exhaustion…<br /><br />We shall unleash the Nihilists and the atheists, and we shall provoke a formidable social cataclysm which in all its horror will show clearly to the nations the effect of absolute atheism, origin of savagery and of the most bloody turmoil.<br /><br />Then everywhere, the citizens, obliged to defend themselves against the world minority of revolutionaries, will exterminate those destroyers of civilization, and the multitude, disillusioned with Christianity, whose deistic spirits will from that moment be without compass or direction, anxious for an ideal, but without knowing where to render its adoration, will receive the true light through the universal manifestation of the pure doctrine of Lucifer, brought finally out in the public view.<br /><br />This manifestation will result from the general reactionary movement which will follow the destruction of Christianity and atheism, both conquered and exterminated at the same time.”
z12bevvbtwmcfls1k22purlrlpycypygv04	Think about all the terrorist attacks that have occured recently. So many innocent people have died because of those attacks. Who were the terrorists? They were Muslims.  Every single attack has been done by a muslim and letting more in would definately result in more women getting raped and more chaos, (terrorist attacks).
z13dvtewjonvsjmbd04cgdnpmlutw5fy4uc0k	I greatly dislike Hillary, but I really hate Trump!
z13lerebtuqed34yh04ccdagczaih5excis	And I totally believe 9/11 was an inside job. Jet fuel does not melt steel so it pours like liquid. Fact!
z13pcbcinubai3dey22fftzyzzy3vl4e1	Since when did banning people from other countries help? Should we also ban all of the Chinese because of the way they&#39;re acting to us? Should we ban all Koreans from coming to the USA because we assume every Korean is from the north side? This will be a long 4 years...
z12lfpeg1rvzstacv22jy3symkv0vpeul	The 9/11 terrorists did not come from any Country Trump has put a ban on. And Mr. Going Coastal  how are YOU going to stamp out 1.5 billion Muslims. Keep believing the #1 liar and con-man, Sir Mien Trump.
z120wbeqyzevhf0m122zf3gxjufdjjkca	about fucking time! good riddance obama, you fucking piece of SHIT, along with your nigger monkey wife!!! HAHAHA, fire me for that one, BITCH!!!
z13pub5zlsyosjvtg23ci1fjxrikcnefn	what a shame the UK hasn&#39;t got a politician that is willing to make these decisions. trump is going to save America.
z13kw35hlyjytta0j23kd32a1sqvi3uhq04	President Trump is to late Paul Ryan and Obama back stabbed America and sent thousands of the bad evil killer Muslims back into united states. I saw the video I texted messaged back to Paul Ryan !!! I&#39;m so angry right now..
z12cjd14tzbfuvj0a223ejq5axfqh12oz04	terrible reporting cnn
z135e3dgcv2nwhgju04cgrv4dmaizrwa030	F**k islam
z12ozby4ttqitpemx22eebyiykrrhfhwm04	911 was done by our shadow government.....
z13zxnzq0ziwivrgi04ccn3heke4fbl5o3w	9/11 was an inside job
z13eev3o1vmkihch104ch3opfpzqijrbpd0	Trump has done more for America in 5 seconds with one stroke of his pen than the traitor Obummer did in 8 years.
z12pcjsaqkvfhhih104chdebhtirvnigx4o	-.-
z13kg5ljjvjfydveg23syfzp5k2ng3zqi04	Speaking the truth isnt racism its truth and facts
z13cfpgplyinsp4ts23zghnrxkasidx0i	YEA!!!!! KEEP THESE FUCKEN &quot;ISLAMIC SUICIDE BOMBERS&quot; OUT OF OUR COUNTRY!!!  ...... yea i guess kick out the illegal latinos too, but they don&#39;t bother me as much as these fuckers! Blowing shit up and killing our people.
z13nhdjzqtuzsnx5g04cdd25tonszh5glv40k	I like the wings and halo behind president TRUMP, very prophetic.
z12xyzkzykqoy1qwz04chv2zny35hp0o5q40k	lmao! I forgot to laugh. it&#39;s funny how you said that. When it comes to religion Muslim  vs. Christian American people, discrimation and hatred is against christians, and white ameeicans. One day people will go  around and having sex with animals in public, it&#39;s that bad, and people will make it legal lol
z13kf3dbjpnogdnb204cjzjirvvlyzghtcc	If you support Trump, you should be ashamed to call yourself an American. His actions will only make Muslims hate America more. He&#39;s playing right into Isis&#39; hands.
z13md11ouw22spwlu22zxtthzp2rct0hy04	not this is ban to idiologic Korean quran readers. Muslim that read the evil Korean should be ban because the quran teach to hate to kill and not be an America but hate the white hate those that are not like as the infidels and Jews the gays and those that do not line with Muslim idioligy religion people lest ban all that are radicalidiology politician and used religion to sneak into the government little by little and take over the USA.
z132wd4wul3dh1nl1224f1or4racyxawc04	God Bless our leaders, Trump/Pence oh and BTW Fuck CNN
z12ef5hozmnpdfglx22dfvrijqa4z3ff0	round blm up and send them to Africa
z13by14osv3pubq2022bw5m54pu5dfuav04	Israel first.... Trumps foreign policy in a sentence.... Your leader is a Jesuit magician....
z13ssn54poeyzvzl323wfzhinr3jhbxdm	No one who is not a US citizen is entitled to be here. Now go tell every liberal, they seem to be stupid.
z12yilloduf0jbakr22yffyz3wftstx3y	Thank god
z13jdfvosveth3xku22mvjxj5xr0z1h3b	muslum brotherhood = teroror head of state
z13us5oqszznzdsgy04cdhcigqydx11zyg0	Fucking dream team
z135hllo5tjest11422qe1qoexuyc5hrh04	Yes, I know. We need peaceful immigrants, the ones that contribute with the economy, not the ones that live off our taxes and are on welfare. Besides some of the immigrants that have come to America have committed terrorist attacks, San Bernadino
z12tzn3h3rnnwzuen22guhcysqixvnv2e	deport those illegal leeches
z13uzvyxvpqtcvlyv04cffvpqv2aehwzir00k	So glad we are now committed to keep these fucking Muslim terrorists to all of humanity out of the USA. I know not all Muslim&#39;s are terrorist, but all terrorist are Muslim...So keep them the fuck out and let them practice the religion of hate in a country full of sand and ruins....So now, FUCK OFF!!!!
z13sj1awnzbszhz5o04cjnyjtmyuutax1oo0k	AWESOME !!! Finally someone is doing something ! I was never pro-Trump, voted to keep Hillary out. But Trump has been kicking butt.
z12asnmw5xmyshero04cgxg4zu30v5sakaw	No Saudi Arabia? They&#39;re the fucking top terror country in the world!
z130yldpxrj3y1mrl04cixuyfm3fzdjyyfw	Thank you Mr. President. God Bless you.
z13rvzabds3vvtckx22gir1oznfoetqf5	fuck Islam. Every American isn&#39;t as stupid and blinded as stupid snowflakes. We will overcome and destroy
z13ksvvbulbhs1ah004cfz3qcv3csfbrwkw0k	I just don&#39;t get why you guys are being so rude to all of the muslims. It&#39;s not like all of them are trying to do bad things. And banning their countries makes no sense because can&#39;t they just travel to some other country to get into the US? Also, there are already a lot of muslims in America, so are you going to make all of them leave too? Doesn&#39;t really make sense to me tbh. I mean terrorists can be home born too don&#39;t you think? I mean it&#39;s not like be we banned all the christians from coming in because of the kkk right? But idk it just doesn&#39;t make sense to me.
z12gxn04wubed5xjj04cdzxpvzmghryprno0k	Tapper is a looney goone.......<br /><br />Trump is the best thing that happened since Reagan
z13jifdg5unsdnvfd22qwdzx5rz5g5qlp	yes! I feel way more safe now!
z120w5jorlvkwniaj04ce5w51umyj3i5f1o	President Trump is Man Of His Words..I hope he will also support Indian in Cleaning Radical Islam terrorists from the face of the Earth..Long live President Trump.
z12zt1kbppvggbh4404cgriievfgdj3jun40k	This is boring. Americans have so much pride in themselves yet they are the biggest failures in literally every single war in the past 5 decades. America does have a powerful army but they are only good at losing. No brains. Just bullets and bombs. Learn from the smaller nations.
z12le1zbuuaecxrrq04cj3c4uv21tfmahrw0k	What a wonderful speech by Trump. Also how great to hear such commitment. AND yes he is already administering such detail. Back to basics, AND enough is enough! How cruel was it that the real patriotic people of the USA had to put up with the last recent presidents INABILITY TO ACT and Secure and protect their lives!...The future is now open and can be re ordered. &#39;Thank You God&#39;!
z12hgl15bpjawzu5504cdxzaynmcx3xj1r40k	Islam and muslims out of the western world now
z13vezqresfhvlnpa04cdvr5ukjdz5jphlw0k	It&#39;s time for yall lazy asses to work those immigrant jobs that no one wants to do but our European forefathers did back then when America was a hard working country!!! 🇺🇸🇺🇸🇺🇸
z13etf0hativj3n4r04ce1dbtkyyvfwaijc	How are muslims the victims? If they want something done and want to justify themselves as a non-threat, then why dont they get rid of radical islam themselves? We shouldn&#39;t be the ones clearing the muslim faith of terrorism; that should be their duty.
z13ts5wrprq3uhlq504cj12ytpi4wnoxqsc0k	The Zionists have made the majority of the American people like a flock of sheep. Soon we will hear that Islam is the cause of the financial crisis in America :)
z13ofjcb1qm4yniqx04ccntawsq0frgxfmo0k	The fact that many comments are agreeing to trump&#39;s decision is disturbing and gruesome. Comments like &quot; taking back our country&quot; is the worst of all, you don&#39;t seem to realise that America is in the situation today because Americans are egotistical. Always, &quot;we are first,&quot; &quot;we are the best&quot;. Yet do crap to prove anything. You are those lousy people that are arrogant and has this pretentious air of superior yet nothing but stupidity and cluelessness.
z12cd1fovtiag34yy04cenbipkvgdrtoq0k	The Anti Christ has arrived.
z12lf3sztzrqy5npr04cezwhflu3ezk54rs0k	This is very disturbing. Trump and Trump supporters -- didn&#39;t you all say you are fine with LEGAL immigration?! You are banning green card holders, who spent money, effort, and time to go thru the legal process to become a citizen, from entering the US? Do you still run this country by law?
z134gbhxbnfnjraps04cdrniauauzdfajvs0k	So, I was walking through Dearborn MI. and I saw that there was a “Muslim Book Store”. <br />I was wondering what exactly was in a Muslim bookstore and so I went in.<br />As I was wandering around taking a look, the clerk stopped me and asked if he could help me.<br />I imagined I didn’t look like his normal clientele, and so asked “Do you have a copy of <br />Donald Trump’s book on his U.S. Immigration Policy regarding Muslims and illegal Mexicans?”<br />The clerk said “GET OUT, GET OUT AND STAY OUT!!”<br /><br />I said “Yes yes, that’s the one I&#39;m looking for. Do you still have the hardcover version???”
z13dxpawgobptvdpw04cebe4jkmdepsizp40k	Fuck mike pence
z12bubwovuugdfxvx22curvwgmqrs5w5g04	GOD BLESS SECRETARY MATTIS, keep our country safe. I&#39;m an 8 yr vet myself (Marines &amp; Navy). If I could, I would love to be apart of the solution to get rid of Islamic terrorists. They have no place in our country. I took the same oath you did, &quot; to defend this country from all enemies foreign and domestic.&quot; Not a lot of people know that many good folks in the South were raised on guns and know how to hit ANYTHING they can see. I AM ONE OF THOSE PEOPLE!!! Should you need me, look me up. God bless America.
z13cebqacyrettqox04cdvypuye4zxbi0y40k	Regaining life, according to what you wrote, that show&#39;s the level of your intelligent, lets just say it&#39;s on life support, because if Muslims, Arabs, Mexicans, leave America you will fight with your own love ones over a single loaf of bread, your country is already in a deep shit of debts and on top of that the Arabs, the Muslims and the Mexicans take their monies and leave your country i really   don&#39;t think you&#39;ll understand the magnitude of the economic catastrophe your Americans will face, Saudi Arabia alone have investment of over $ 2 billion dollars imagine that money leave your country and it go back to Saudis, let alone the Mexicans as well, and you know the Mexicans are hard workers content people and willing to work any jobs that you will not do, see Donald Trump is not going to feel the panic of the jobs shortages because he&#39;s rich but you are going to endure it, so think before you talk or write.
z12xhl3ytmbyv1xiy04cjtgxxxnpup2yb30	President Trump and Vice President Pence rebuilding America&#39;s back bone!  Thank you and God Bless and keep you both safe.
z120zlaj5oe3sjmrn04cgfbydyiadh0inxo0k	u mean 2 tell me after all these decades America didn&#39;t have a wall, I assumed that was there,  my dumb butt, u know what happens when u assume. well Trump don&#39;t assume shyt, ima start calling Trump I mean president trump his new name Action Man or AM fo short
z13rxx2ignyighizp04cdx3ptlnrzxjxtzo0k	Saudi Arabia and Pakistan are the most radical islamists, yet they&#39;re not banned.
z130vpja5zvvi5ozf04ccdagczaih5excis	A decade of war? R u fuking KIDDING me. How long u been in Afghanistan?  You need to look after ur own shores not destabilise other countries for ur own greedy selfish gain. Oh this guy likes action does he? Yes warriors, ex soldiers left homeless on the street begging!! I don&#39;t see one thing done for them this week. I totally agree with the radical Muslim keep them out. executive Order. Well done. I hope Abd pray America that U DO WANT PEACE. Since 1776 till today. U have been at war for 179  of them years. U think u can change? I am praying for u America. God bless. From uk.
z12aspuw4nesutkbb04cg1wgbnisyrpbokw0k	Sorry he is not going to be politically correct. We are tired of these people destroying lives. Sorry if you are peaceful law abiding Muslim gives you all the more reason to turn those people in that are extremists.  I do think however this will not be enough, and if he doesn&#39;t screen people coming from all over the Globe then it will be pointless they will go to another country and get in that way. Saudi Arabia and UAE should be on that list but the Saudis would see that as an act of War...And we should expect there will be attempted attacks on American Soil so don&#39;t think for one second everything is OK.
z13aenuiup2jzd1g404cjpagvkyevzvqjzk0k	Already done more than Obama did in 8 years.
z125ctnbaxvyc3j2a22vv5bg3qbti1cfr	Look at the stars on background. They are so symbolic.
z13zsbwhgmi1xdfes223drm44nactnw5v04	No Sharia law coming on this American soil, I have the right to bear arms!!!?😏 God bless President Trump, God bless the united States of America, protect us from these radical Islamic psycos, a religion of &quot;peace&quot; more like a religion of death and destruction, we allow Muslims to come here to America to openly practice Thier faith, mean while back in their countries Christians are being slaughtered like sheep!  this is and will always be a free nation, this has nothing to do with racism or bigotry, this is about the safety and security of our country, better to be safe than sorry.....I don&#39;t care! who feels what, call me ignorant, call me paranoid, we have to protect our country from all threats, period....who ever opposes Trump should pack Thier stuff and go with these Islamic radical pysco paths. In these Islamic countries of so called morality and &quot;peace&quot;  if a woman is raped, four males have to be witnesses for it to even be considered a crime in Thier courts, or she has to scream loud enough so someone hears that she&#39;s being brutally raped, also most times the poor lady or child, is forced to marry her rapist, so that it doesn&#39;t bring shame upon thier family!!!!???? are you kidding me??? that is repulsive and disgusting......<br />Ughhh......
z12rxnag2pegsrmwm04cczzoeouhtrwxmss0k	Go Trump!
z12oglvrfligc5hal04ccz2imzzbhxiya24	Ban all Muzzy Trash, they are the filth that will be eradicated.
z13ixr5yfme5vnfz004cgtsgmvjowlsybgk	Class!
z122tneoaxqwgztfs23bjhjbjz2rs5mxq04	Those who would give up essential liberty to purchase a little temporary safety deserve neither liberty nor safety. Ben Franklin
z12qxbng5wrec30pt04cgzlyxouyutth52c	trumpity, trumpiry SAT ON A WALL ,CAN&#39;T WAIT UNTIL  THEY ALL HAVE THE GREATEST FALL!!
z13deduzylm2xtjpn04ch1oh1vbkytjwp24	For all you Libturds: Listen Up!  This is entirely within the purview of the POTUS under current law.  Did we admit Germans and Japanese during WW2?  Hell, No.  While it is the Constitutional right of any American citizen to be a Muslim or an idiot [no difference between the two] that does not mean that foreign nationals who are Muslim have the right to enter the US.
z12wdvwpevbpd1izx04chzi5hyazdroabno0k	Thank you President Trump!!!
z13gejmximmvxtkqt04cjvxziwrpv3wjytw0k	This is a HORRIBLE idea!
z12fjdeamtuexp5y404cgn3ztpndsbxh0pc0k	You know he&#39;s not banning Muslims right? Just from these 7 nations for several months. Muslims from Bangladesh, Indonesia (world&#39;s largest Muslim country), Kuwait, Oman, Malaysia, Bosnia, Kazakhstan, etc. are still free to come and go.
z13jcjdhyovwxvryd04cd1pjfrfdfb1qodk	only smart thing he has thought of
z13cvr1riremvbwcs23bxzzjtr2gvjbkf	for a country that was created by immigrants you are pretty dumb
z12qxvqpcoqlfnnjw04cetzalqrpudpaius0k	I would rather tell the rest of the world to go fuck itself than to worry about having a bomb go off next to me while I am out shopping with my family at the mall one saturday. Fuck the middle east and Europe should follow in America&#39;s footsteps.
z12dibqjwuzlxn4de22nxnwwqla0xrocw	i hated tump but fuck i never he is doing shit that no other president had the balls to do
z12fttrbrsqgyhf0x22rdxag1pr2y135004	ok wait, can someone explain the pentagram with a slave on it in the background??
z123vva4uufgwtc0s22hfzwh1wmktnxka	Now all the Liberal morons will start screaming racist.
z12gt3brbqu5x5uwf04cc5ta5uitchfrxqk0k	Dont let yo President get you fuck up
z12rgfipepn3fhi1k22gf5qahmqrjpgwj04	God bless this man!
z12lg12bnxuvc3xji04cgd3pzrbzxhs5g2o	Finally, some sanity in the world!Political correctness will be the destruction of civilization
z12eypkzdvqagrtbn04ccjmzguigz50jn5o	hell yeah
z12yhjewzwnncxx4004cirs4ynqljtlrvmo0k	TRUMP IS A HERO ALMOST NONE OF MY FRIENDS BELIEVE HES KEEPING HIS PROMISES, WHAT A  MEN.<br />A LEGEND.<br />TRUMP THE LEGEND!
z13li1d45kvjhlafs22dsr0rxkz1gjpie04	A General as Defence Minister!! That&#39;s how should be not politicians!
z12iddmqsz2ewnrje04cez5q5snqxdl5oe0	White Americans are by far the most easily controlled people in the world, they are afraid of anything and everything, they live every day of their lives in fear of the boogey man that isn&#39;t there lol. The only time they ever even speak up is when they are in a group or online but out in the real world they keep their mouths shut out of FEAR lol
z12hcbzyjqewgxj5r04cf55o3qqqfr0p33w	Deport all the Jews to Israel too....let them fight it out among themselves..too many American boys and girls have perished in senseless Dumbya EOP wars!.....eop....enemies of the people....valor....fuck you Sixpense!
z12oefl5mrrmctn5y04cjb35rxeps3awdz00k	is my paycheck gonna get any bigger with this guy as my president?
z13bcbrodwrrvd2go04cdndp3v2tvrijgdc	i am sick and tired of seeing those rag heads demanding for change
z13stt5beuzjvbl5d04ccnewetn4zdjanbo	With that pace, Trump will be bored out of his mind for 3,5 years. &quot;Mike, is there anything else for me to do?&quot; - &quot;No sir, everything is fixed and running like clockwork.&quot;
z125gdoxwsr3xn4am04chvvx2mildf14mgw	I hope Donald Trump, Mike Pence, and Mitch McConnell all die very soon
z13qdtyg4xemjhdz404cgp1w0penyhkrskg0k	usa is the most hated country in the world  at the moment and i m loving it
z12hv5oaypn2hrmei22yy1mhxrrhd15yn04	America first! we are a constitutional Country NEVER Shariah and Moslems who can handle this GET OUT!! our 2nd Ammendment protects us
z12uwvwinzravbuen22uib34tn2zvjnvq	Good
z13ixrfziunbgrbn523gv3eqqpvmhd0vr	Just realized how much I used to shudder and hold my breath whenever someone introduced Obama, this time I feel relief seeing Trump come out after hearing &quot;the president of the United States&quot;.
z130xx4i2kawvrzrb04ch1zj2omszth4kcs	I just wonder how we are going to pay for those new planes and ships?
z13jhjhwounphh4xf04cetcpemqiflp4a2s	he said part of the oath wrong so..........
z12rvnmgluqbdlhu523ksvbpdlrjvbtyq04	my kind of guy and mattis i know hes going to make a  great military again and hes my kind of guy
z12mwdd4az3thbucy233x3kzglaotdyfe	"It must be a curse to have been born <a href=""http://o.in"">o.in</a> either one of those countries and if anyone says otherwise, why are they so desperate to leave such places behind??? Kudos to Mr. Trump for doing what it should have been done decades ago."
z13refkzdmqgg11sm22ryrmwxofoxnddf	The salient question is that the jury is still out on who/what was really behind the 9/11 debacle. .. President Trump should, and I hope will, follow through with his investigation on the real truth behind the so-called 9/11 terrorist attacks.  And watching him so far, he probably will and not fool around with it. Though, what will he do if certain individuals / groups( ie Bush, Cheney, Rumsfeld, CIA et al) in the American government are found to be complicit in the perpetration of this disaster as well as the follow up spurious involvement in the expensive- and wrong- Iraq and Afganistan wars?
z12ccvxjjtn4xb4ub224g1rghkmycfw2g	&quot;You may be seated&quot; isn&#39;t as good as &quot;Please, be seated&quot;<br /><br />humble. humble. humble.<br />and fix the nasal wheeze please Vice President Pence.
z12oxdrqutiuthqyh04cfjzgnpigdlijsj0	im sure all of you youtube comment savages have seen the Mattis Soldier meme
z12kvdxarleqwlofh23lzlti1zfktzu2a	God Bless Trump!
z12qe3sgmx2gfri3v23uerswtkvawz2pn04	I do not agree with everything President Trump says especially about Kenya where I come from but I think this is the smartest thing that a leader of the Western word has done yet. May be Mr. Trump is not a racist; just a president watching out for his county&#39;s best interests. Muslim immigration to majority Christian countries should be halted immediately. A Muslim has no business being in a Christian country, otherwise I&#39;d also apply for Indonesia citizenship. Muslim countries don&#39;t treat non-Muslims any better, trust me, I have some experience. My only regret is Saudi is not on the list but Kudos Mr. Trump.
z13lz30gyza0yamkkqm5grrohkbnx3ys1	that is a shame....he  and net a yahoo will not even give the chance to palistine to avoid the ignorant  that continue to steal with a deal
z13eipkx2xngfl5ql04cj1zzaobyxlywqac	all I know is the America that one&#39;s was is back if you truly believe my comment u know u are a god damn American
z12ajv3rbwzfxptwf04cgb04kty4ev445f4	I&#39;m a Trumpist, but I&#39;m very disappointed with Trump&#39;s decision. 15/19 of the 9/11 hijackers were from Saudi Arabia. Most of the Islamic terrorists are from Pakistani and Afghan, and Arab backgrounds. But Trump hasn&#39;t banned immigration from these countries. Yet... He bans Iranians even though 70% of Iranian-Americans are <b>NOT</b> even Moslem, many even despise Islam. Unlike Moslems, Iranians, on average, are among the most academically successful immigrants.
z12fszwiptuhgr10j22mwfxgixefhptfz	KEEP THAT HEATHEN SCUM OUT!!!!!!!!!!
z13wer0zxonqe1qvo22mjdkaturvwbjl3	why isn&#39;t Saudi Arabia, home of the 9/11 terrorists and finaciers of most radical islamists, on the list....because Mad Dog like all yankee military HAS NO BALLS...puppy dog mattis.....satanist pence....
