Comment_ID	Text
z13sgxfi2me3t5xss23iw3oi5zj1h32vo	Guys, we didn&#39;t elect you. Kindly keep your views to yourself, and report the news. Thanks!<br /><br />(There is no &#39;right&#39; to kill a human in it&#39;s mother&#39;s womb, at least as far as rights are said to come from God).
z12nwxgjiojmdpvt122pjfypxp2mtj0mr	Trust CNN to twist the story again
z135ffvblvq1ddzkp231ddvpgzezjzdbt04	good man
z13uylyy3x2uipny004cfpopwyygslcxecc	people all Muslims the are not bad. the are good Muslim and bad Muslims the are good Christian and bad Christian. and a lot of Christian stay in Dubai by peace. American people the have to open the eyes look around the world and see. before taking about all Muslims bad.
z12oxxviovmbvvet423mztfzynq4vz4wk04	Didn&#39;t this already happen on the first day?
z13awp2rhluhsjfn123bjf34rxikidklr	This ignorant country has played itself once again...smh
z12mhzphamj4wxnqm04cfzaouuvvivtaldk	I love Trump I hate CNN CNN are compulsive liers .
z13svnwomma5gzubi04cg3xxxvmyxxnay1w	majoity of the terrorists come from saudi arabia and pakistan. why they are not in the list of Trump?
z13fizvhmtyeu3bpv04cepx4dqyuvpj4iuc0k	Start with long lead time funding for CVAN 80 and CVAN 81 in supplemental to existing defense budget.
z12edleqora4ghy0m23pt5tqromzyfb4z04	Europe leader should do this.... But their too coward to make the decision.... Hmmph..
z13cspvw3yatgf5vv22jghsrbx21sdwvs	&quot;We don&#39;t want them here&quot; is a strong message, and severe blow people who want to Islamize US
z13dtp5psxftxjija04ccpyofzmyer5q1vs0k	😂😂😂😂😂😂😂😂😂😂😂😂😂😂😂😂😂😂😂😂
z12cdjapbri0irhhp04cgta4fwbch3xwxbk	Wow America starting to look like a shithole now, who would want to go there
z12qu3yptzqwzn1ay04chro4hzjpep0wyp40k	no more immigrants !!! good for Trump.  people are running away from violence and whatnot should stay in their country and fight to get it back
z125tvwhwqqfjpffo22ytd2iexfafrpkd	another president another Israeli puppet, what is new. Just like the presidents before soon billions of tax payer money will go in Aide to Israel and for what.  As we all see putting Israel first not America soon enough we will all see that, Trump will send young American to war for the sake of Israel, wait and see
z133shhbmkbiyzbsd23ztvlxvqb2utc3q	Pence breathing into the microphone sounding like that dude always behind Helga in Hey Arnold.
z12cunhx1tfvuh4us23nxjtqvpjospgao04	Some of you people are such imbeciles. Not all muslims are terrorists. The muslims who aren&#39;t terrorists need to leave their countries so they can be save from the ones who are. They&#39;re living in a war zone, so stop saying they should stay there. The US has enough money and food to provide for them, and they&#39;re not stealing your jobs. You only say &quot;they steal our jobs&quot; to the people you hate. My family consists of Austrian immigrants and nobody has told us we&#39;re stealing from them.
z12uepnz1yawjntb504cf14qtomvzrsbd4c	Wake up fool
z13zgfm4bqnnft3ha04cfvcxvtn4gp4x0y00k	But he doesn&#39;t block immigration from Saudi Arabia? You know the country that funded 9/11. Oh that&#39;s right, because his billionaire friends and him have money invested there. How convenient...
z12wiz1odzjejfwys04cgr2hhkmmcdux0ls0k	HI ADD ME TO SNAPCHAT SCREEN NAME johnjames1973 INSTAGRAM businesslaw211 TWITTER businesslaw1973 YOUTUBE businesslaw John James
z12phjzq4waahz3rz04cjxtpjmiwzhxr1ls0k	&quot;put your left hand on the Bible&quot;  can we ever get real? why swear on the Bible? god is not going to help everyone lol
z13pwjwolo3svxyzj04ccjgrfpmxizarylg0k	BOZO THE CLOWN LIVES !!!
z12txnmb2qumdltvv23qcdj4qnuxzf0by04	damn trump isnt fucking around i thought he wouldnt do much of what he said, but i guess he proved me wrong
z13fsl4iwt2qdbrrs04cdrrylvzmdvegevc0k	stop all these fucking invaders. each and every one of them. we don&#39;t need them rag heads in america.
z13xihq5hl3mgjffj22cg5oh3xbhd1gy204	Love it... the adults are in charge again!  God Bless America!
z13uejh5irnrcftdp22oi15qtlvgj3sy404	The grown-ups are back in charge!
z12qzt4jtlz4iv2sl23yhflylomnstwm1	but but but hurt feelings
z12yzplymyz5fjj3g23ot3mhqw2yzx4v4	How are people saying that he is discriminating? Muslim countries look after muslim people and don&#39;t act favourably toward other nationalities - check. So thank God he is taking  a stand and toward christian Americans.
z12bhttxjwquv3gyt04cg5rwfyezvd0jn2c	God bless our president; and God blessthe U.S.A
z130gxxomuvyzzyzz04ccj0xcnrch1opvzk0k	The people that get the free stuff are scared. They shouldn&#39;t be. To get the people off the working class back Trump needs to provide jobs to those who fell victim to Obummer. Its not gonna be easy to come back...we got it!
z12jidhrctn4cj2je04cejh44uihez3o40c	Why is trump a good president? Because he is doing testing to see what works and what doesn&#39;&#39;t.
z13pgfzxdoe2hlmdt23jvnfogt23uhl0l	nope, it&#39;s a lifestyle,  dr bill warner tells of the law of Islamic saturation. Muhammad jihad must kill the kaifers, non muslims, and the true islam. ..
z13lst4xxqixwvimj22guhcysqixvnv2e	Muslims are the most rude people, next to Chinese people.
z13nvnly2pmvvlwpz04cj3ordz2xt3xgdts0k	Solid. America doesn&#39;t need any more people.
z13tjlxiqnvdslg2422sdlqhhtzhdvh5w04	Completely ridiculous... they are already here and 99.9% are not violent. Much more Americans killing each other
z133dtxigk2tixqes22rxprxqun3i1cnl	Good news for once  did i  wake  up on  a  parallel  earth?
z12khp5qgq3jg3avb22qidt55kabvea0	Shakespeare would have uttered &quot;Something is rotten with the state of the United States&quot;
z12mtrggpoqtjd01t23isrwzktfhc51hl04	and besides since when religion is an issue
z12rulqa3tqzg1xpg04ci33gypaaxzgzbus0k	trump pence mattis best things that happen tot he usa and i am so glad to have them all
z12ox1353sqkchtnt22xhpfqlpzmu5gsq	I look forward to running for president... anybody can do it and win
z12bdbiphlacslpi204chb4pmlrax11imv00k	HE HAS A POINT ISLAMIC COUNTRIES SHOULD TREAT CHRISTIAN BETTER ....UNFORTUNATELY SAUDI ARABIA WAS NOT ON THE LIST....THESE MUSLIM COUNTRIES TREAT CHRISTIAN LIKE SHIT....I JUST WISH IT WAS BETTER IMPLEMENTED ...WHY IS IT THAT ONLY MUSLIM MAKE IT TO THE US WHEN THERE PLENTY OF CHRISTIANS IN SYRIA , IRAN ,AND IRAK.
z13ovh5hfpytg5l2v235uhxqxvf3exfnt	Notice the ticker tape...must have only interviewed democrats!
z125f1lguprke14pq04cfx1glmrasvqwnqs0k	Ce n’est pas vraie que l’Amérique a été construite avec l’immigration , la vérité c’est que se sont les riches propriétaires terriens américains qui ont profité d’une main d’oeuvre esclaves a bon marché pour s’enrichir encore plus , une main d’oeuvre esclaves africaines qu’ils faisaient travaillé a coup de fouet , Souvenez vous des navires négriers qui partaient de l’amérique pour aller cherché des esclaves en afrique , il remplissait les cales de ces bateaux de 500 à 600 esclaves , un voyage qui durait près de deux mois , et arrivé en amérique ils travaillaient pour les gros producteurs terriens pour pratiquement rien .
z13kg5aqtwb4jvj4o04chjmwgs2pennwyeg	This has ALREADY been struck down as unconstitutional. Hilarious people are still cooing and insulting everyone that disagrees with them.
z13mwfzbryeqxp1ho04cc1wj0obyijowwrg0k	Outstanding!
z12nubwjjwu2eb22k22oi1ngzv3dxxale	Will mexicans living here stand up for Americans...? will muslims stand up for America? who will defend traditional American values, will minorities do it? will refugees do it? will mexicans fight for the prosperity, peace and stability of life in the US?  <br />If real Americans don&#39;t stand up and protect themselves....who will?
z12zvnsx1lehg5a4w04cj3twgpnlxfdx1qc0k	Good. <br /><br />Fuck those countries.
z12kvr34rtvue3q4x04cg5sotsuxzd34gsg0k	good job Kelly, just silenced this fool
z13ysx4g5urjf3aey22idncggtzpzdtqc04	People are going to be buying boats left and right now due to all the SJW tears.
z13qtpioiv2czzf0s22dilsasqjbsjjfg	I&#39;m a Mexican living and working in the USA, I tell you and Donald TRAMP, to lick my Mexican meatballs drenched in their own natural juice, FUCK YOU AND DONALD TRAMP. MAKE ME LEAVE BITCH.
z122uzo5gqihjzalz22tyblgwmy3fdvrb04	melanie blonjow at sargent porto rican fucking idiot trump
z13ffrog1lqpzxvv022pgnp5dkrtxlnib04	ISKO BHI ALLAH PAK NE HI SADRATH DI HAI ...IZZATH AUR ZILLATH KA DENA WALA ALLAH PAK HI HAI ...AAGEY MALOOM HOGA KE ALLAH PAK KI MUSLEHATH KYA HAI  AUR ISSEY WO KYA KAAM LEGA ...   INNALLAH  MA AS SABERIEN ....
z12yf3aj3nnuxzwm222cznoyoojavzjh504	this is fake news.....due to the CNN logo on the right
z13twvfr4xz1ixbar04cdvsjxmvvyv3gbmw0k	The Quran is evil, it says to lie and mislead non believer, how the hell can we trust that?
z12sx3wj4zuwh5xwl04cfl1pxzrnvp4q0l00k	Hey President Trump, it&#39;s about time.  It&#39;s also time to monitor all Moslem living in USA especially where they pray.
z12gy1swyqesx1wbt04cejmiupmbxfqpes00k	Fuck yeah!!!!
z12iuh1jbxf0uf5ce220tvmhbufndl4w504	Trump you stupid son of a bitch, there has never been a tererist from one of these 7 countries??  Why don&#39;t you name Saudi Arabia?  I will tell you why because you do business there,  Pence said in many tweets that banning people by religion was against the law and the constitution?  What is he now becoming a lying puppet of yours. Why does he stand up.  You bastard by this order you just put the US troops all  5000 of them in Iraq in danger.  They are fighting along side the Iranians and Iraquis and you insult there comrades at arms?  911 attackers 25 came from Saudi Arabia and the other 4 from Pakistan.  You are dangerous and will ruin the USA and already as a MINORITY President you have acted like a fool.
z13yxhiyspfbvzz4w04ccrroflywfp2jp30	If Muslims are being banned, why aren&#39;t the Jews? They&#39;re practically the same, aren&#39;t they?
z132e1dbvnrhw3dmu23jdzdgqwi0z5pxn04	ONE Problem: AFRICA FOR THE AFRICANS, ASIA FOR THE ASIANS, WHITE COUNTRIES FOR EVERYBODY IS WHITE GENOCIDE!!
z12vw55gbvnvsj5lo23fjv1qfumkxfil4	Is Obama going to prison now or the same shit ?
z13oy3b4ctzvvbiti231s5uxjkatthcg104	SAUDI ARABIA IS THE BIGGEST SPONSER AND EXPORTER OF MUSLIM TERRORISM.<br />WHY IS SAUDI ARABIA NOT ON TRUMP&#39;S LIST OF MUSLIM TERRORIST COUNTRIES ?
z13wjpcxspmodl4ps04cildotwz3jbcgp1c	To all immigrants legal and illegal, in a rush to become Americans before you can be sent back home. Remember, now your children will be on the front lines fighting useless wars and you will be paying taxes like everybody else. The best you can hope for is that Trump revokes all new citizenship papers and you get a free ride back home. Think about that for a while. And incidentally,  its usually Democrats that start the wars.
z13bj5hgerzrdvcob04cibvrukavy1d41w00k	Good! Let all Americans out of those countries too and boycott all American products.
z13cwhtjakqzttgoc04cffdotkn4fjti2zg0k	Why do we let old white men rule over us??
z132ddazkvi5djiqg04civhyjtmpidtzjhs	Finally a president that GETS SHIT DONE!!!
z12oux5xknqyj51y104cif2iwuydxrepag4	"Did President Trump memorize any part of this speech? <a href=""http://www.youtube.com/results?q=%23bewildered"">#bewildered</a>"
z12if1yp3tqxxtxb404cilcr5wqqifjwsxo0k	is this one of those fake news networks?
z123xxw53yypgniyl04cdvwynuvwtd4wkgw	So he&#39;s halting immigration from countries that the US are currently bombing or have bombed, but fundamental muslim countries and human rights abusers such as Qatar and Saudi Arabia are still welcome. Bless, America does have the biggest numpty as president.
z13ecv0bgkmrglpai04cgjipmviwdpgwdnk0k	Well if Bush1 &amp; Clinton &amp; Bush2 keep their nose out of the middle east business <br />we wouldn&#39;t be in this mess, We need to help Russia stomp out ISIS and leave<br />these people alone, Let them have their civil wars and the victors will run the middle <br />east like it has always been, When the dust settles are Muslim Migrants need to<br />be sent back to where they belong in a cultural that makes since to them.<br />but I&#39;m afraid nothing will satisfy liberals and millennials and they hate the<br />thought of working because mommy raised them with out working,<br />Why should they, After all this rioting over Trump maybe abortion is<br />a good thing because we got a lot who should have been aborted.<br />Dammit I don&#39;t sound much like a Christian now.
z13mzlpgrmvthfkiy04ciznhhw3iubcixjs	Halting immigration,great decision,thank you to care enough  about us,in Trump we trust.
z134sldh5la4vddvo23oclrjqwisfrbec	You fucking kidding me?
z13zfjso1vn4hfk4x04ch51j0qilirwphns0k	President Trump is doing everything he said was gonna do at record speed.  At this rate America will be fully restored to greatness by this Wednesday.
z12he3xqhwjxj1lyq04cgvbihpm3fdbag2o	NOT ALL MUSLIMS ARE TERRORIST JUST LIKE CATHOLICS ARENT BOMBERS ,ITALIANS ARENT MAFIA ETC ETC ETC . AMERICA WAS FOUNDED ON DIVERSITY THIS IS A SMALL MINDED DECISION THAT PROMOTES THE CIAOS THEORY ...WRONG....WE ARE ALL ONE HUMAN RACE. THERE ARE EVIL PEOPLE IN ALL RACES AND RELIGIONS... WRONG DECISION...
z12psvbxnzqjcj5ek22eg3ew0tm4spmec	how can you like this shit
z13nwjdittbgynbj004cddxhwwfsfjtiatw0k	OMG!!! This douche bag is psycho
z120sbo5gpunzlcps04cgn2aanyae1g4cyc0k	holy fuck...I can feel America becoming great. it&#39;s actually happening
z122vvubjznkzl3vq23evbg5qzilz5r2x	<b>(f) Suspension of entry or imposition of restrictions by President</b><br /><br />&quot;Whenever the President finds that the entry of any aliens or of any class of aliens into the United States would be <br />detrimental to the interests of the United States, he may by proclamation, and for such period as he shall deem necessary, suspend the entry of all aliens or any class of aliens as immigrants or nonimmigrants, or impose on the entry of aliens any restrictions he may deem to be appropriate. Whenever the Attorney General finds that a commercial airline has failed to comply with regulations of the Attorney General relating to requirements of airlines for the detection of fraudulent documents used by passengers traveling to the United States (including the training of personnel in such detection), the Attorney General may suspend the entry of some or all aliens transported to the United States by such airline.&quot;<br /><br /> - 8 U.S. Code § 1182 - Inadmissible aliens
z12ggdw5xp2iinbmc22vzfrywzqnhne2o	Thank you for protecting the people of the u.s.a. mr trump.Its about time
z13ljrcr1o2lcho31235ypho2lybypokb	This will do nothing
z12ihbsx0qfjiv05404cdzqavsbpzjhj5uo0k	Well done.
z12xyvhwzqfuutop204cenkjflb3fldxxak	Gold satanic star
z130ypaqfs2dgvwzq04cdzjhrk3bedjhowg0k	The United States is the biggest terrorist threat the world has ever seen
z12owvmbgz24ijidl22bwlh4ixbecpfbd04	I just came like 5 times. especially  during the bit wherein he sanctifies the armed forces. I jizzed on the flag to show my support for Trump. God bless this man. May he slay satan.
z13lcxkwbx3oxhyao04ccvijckv1ezqjifg	Fuck trump
z12bjlszgt3pcdit122xjl3xtubjgnylv	Don&#39;t hurt Radical Muslims, Don&#39;t injure them, don&#39;t put them in Jail, just send them to their native countries ............. Problem solved ....!!!
z121sjmolljjxvzsy22dfhjxjprvwteuo	Thank God
z13kjrjpllbpvx00p23dhh3y3si1uje5004	doubted him but he&#39;s already done a lot wow way to go!!
z121srrq1vybynscu22xed4j3vz3jtiox04	you bunch of pigs
z12jgboqdsvjhdh0g23bxx2zjkbzyrz4204	god bless these men
z12vupahbxzzdtxy204cirsrypfuvlvrkrc0k	I really hope the shit doesn&#39;t hit the fan during Trump&#39;s presidency. If it does, it will largely be blamed on him and his supporters even though he was doing good things for the country.
z13vfpcj5z33wtmfl23zh1cq0vzaftwnu	Trump signs the order and its already halted by a judge.
z12de5xzivn2vt20h22kuhobetm0fbifx	Extreme vetting. Figure out what&#39;s going on. Figure out who is who. Go from there. Common Sense!
z13kgt2g5w2hilxcd22zzn4rtkj1efcox04	Here is the thing.  IF Muslim terrorists were behind the 911 attacks,  then THIS is 15 years too late. <br />On the other hand,  if it was an inside job as many believe,  it is still a very good idea.  <br />We can give the money we save from taking care of, supporting them, housing them,  giving them grants for businesses...grant  that money to those in poverty who are doing their best and still half starving.   We have poverty stricken families who do not benefit from special rules for certain groups because they aren&#39;t in any of those groups.   Let&#39;s help them out. <br />There are southern, rural families in the Appalachian states who live far below the poverty line, abs could use clothing,  nutritious food,  shelter,  a good start on a farm business where they can have a better life... and on thier terms.  (within the law of course).<br />Turn violence back at the gate. <br />No matter where that violence is.
z12tcpyqxyyojjlxm04cehzj3rz0slhhess0k	About fuking time,  a real American President...
z12hs1bhmsvlgvuoq04cdl3i2m2cxt0atn00k	Who created radical Islam??? I can tell you. It was the CIA. Research it people, they created them, they created the whole jihad mentality, killing yourself was always against the Q&#39;uran but the CIA radicalised muslims on purpose to get ready for the NWO World War 3 they were trying to kick off. Do you know what the plan is? I do. Soros funded the migration of all the Muslims from their home lands, the CIA created ISIS and such, then, after they have all been forced into the Western countries HOLLYWOOD is planning to release a movie portraying the prophet Mohammed and showing his face in a story about his daughter or child wife. I know this for a FACT as my friend was asked to do the FX on the movie. I talked him out of it.... It&#39;s all a plan. The white elites are pulling the strings and we are all the pawns. They hope this movie they plan to release will create a holy war for Islam to make all their followers start attacking the lands they have moved to.
z13sslnwnznbwnd2k22xeveisoyjvr4hs04	CNN can find more ways to lie and misstate things than any new agency around.  They should be barred from new conferences.
z12mj1dzslbcwrifu234zlsb1saquj1ev	Omg, Trump is really making America great AND SAFE AGAIN!
z12wilexbuaqw5vb404cibqbkmrdhlj5vg4	Let&#39;s stop the bullshit. Who gets more out of illegal immigrants, Democrats or business?
z13gwnkr2xqxvpv1c23utz2qlmarhd2gm04	So much class on stage and in the room unlike shitty false news CNN!
z13iy53gszuxet51z23csb5hxpqwexygh04	To the people who hit the dislike button.<br />You think that he just has Muslims but.. listen here.<br />There are 1.6 Billion Muslims in the world, And I do understand that they&#39;re not all terrorists.<br />But between 15-25% of Muslims are radical.<br />that is between 240-400 Million people who wish to sneak into your county and murder you.<br />We&#39;re basicly at war with a country as big as us, And I think it would be absolutely insane to just let them in freely into our country
z13be1qijsmjwfdsd232gt0jdkewc2i0	Its a time of war. All borders should be closed. until the conflict is resolved<br />Do what you gota do TRUMP.  He actually gives a shit about the people that live here and wont bring more immigrant that might do something in reltialation to whats happeing.<br /><br />if you don&#39;t understand that then theres something wrong in your metal. cause if someone was killed my people is masses I would take what ever chance I could to get some get back. so why bring them to the homefront to give them that chance.
z13rcdraqtvtwnkyv04cixngpt25fp1qkcs	Trump showed all his cards in the debates and election. His prepared speeches are inconsiderate, ineffective, and fake. It&#39;s like watching someone pull teeth.
z13ohbwipsm5t5qur23dghgzhxiwudpbi04	I&#39;m wondering if they have run into the black eyed children or adults in our country yet
z13ywdkrezr1ch1z204ccbmyazn1erfasyo0k	I think the Native American Indians are thinking the same thing about their land. How ironic and hypocritical we are.
z12ldzhadlehfvpu223isrwzktfhc51hl04	Can someone please tell me if your a American why would matter what Trump does, everything he does is for our own protection and etc. This is something that should of been done years ago. So now we finally get a good president that is in action and bringing security in, and still you want to cry about it. It&#39;s not racist, hatred among these people, if these people came here and didn&#39;t do the things they do, this wouldn&#39;t be happening. Love brings War right!
z12pjlex2wqxwvtkk22zelg4lkixgbxk1	Hell to the fucking YEA! :-)
z12jdnxafx2iyvdpz04chfibulmez1zwju40k	Trump isn&#39;t fucking around.  He&#39;s getting shit done fast
z132clpyfmalirryf04cgjpiaxbhf1noqe4	he is an idiot. why not ban Saudis? Iranian Americans are in top immigrants in the US along with Chinese and Indians. Iranians assimilate the fastest among immigrants and no country in the world had problems with Iranian immigrants.
z13qjf4zpqefspdrl04cg51gewuai3hgyms0k	Heroes? sure killing in other people lands is very heroic in the eyes of a nation of murderers:<br /><br />Iran (1980, 1987-1988), Libya (1981, 1986, 1989, 2011), Lebanon (1983), <br />Kuwait (1991), Iraq (1991-2011, 2014-), Somalia (1992-1993, 2007-), <br />Bosnia (1995), Saudi Arabia (1991, 1996), Afghanistan (1998, 2001-), <br />Sudan (1998), Kosovo (1999), Yemen (2000, 2002-), Pakistan (2004-) and <br />now Syria<br /><br />This is but a fraction of the US sins.<br />Geez i wonder why muslim hate you huh?
z12pevfaxyq1ehoa504cdf4r2yvns5iqvtw0k	HAHAHA look at pence about to cry as he talks about rebuilding the military.. it&#39;s like he thinks trump outlawed gays!
z13lh3o4ryzwedqe123phntj2rq3clo4e04	thanks demonic soul im not even american im english im in envy of america  and there great leader he will change the world plz god
z12twjkg0timspd4s04cgfhoxyezwdaw5ic	Donald Trump great president for America! <br />9/11 says it all so meny people lost there lives! <br />ban all muslins coming back to America and close down Mosques! <br />We need this in every city Now!
z12iwtph0nqljl4d222twji50nqvwxgcj	We need to include ISRAEL in that little group...and in fact, we need to throw the 40+ congress members out of this country who hold DUAL CITIZENSHIP TO ISRAEL and the U.S. How the fuck can someone be elected to OUR country&#39;s government and STILL BE ALLOWED TO HOLD ISRAELI CITIZENSHIP? And ONLY Israel can do this. No other country. They don&#39;t even speak English as their FIRST LANGUAGE. Canada can&#39;t do it. Britain can&#39;t do it. So what the fuck makes that terrorist cunt-tree so special when they are fleecing America out of our resources, money and military technology, that THEY can participate in OUR GOVERNMENT? Do you think I could go to Israel, get a little citizenship card and sit in THEIR government? Right. If ANYONE needs to get the fuck out of this country, it&#39;s Israel and their people. GET OUT.
z13mx3ogexnjt1lp104cityy2zjbxlmh2v00k	A president finally putting the safety and wellbeing of his own country and own people FIRST above the needs of others. How awful. How terrible. How dare he stop immigration from nations where ISIS and Islamic terror are rife. How utterly appalling of him.
z13ydjjrixzoxp54d04cifbbjvz1zxuinig	This order is based on Title 8 US Code Section 1182 enacted in 1952 under President Truman.  This law has been used many times by many presidents.  It was used by President Obama against Iran for a  six month ban in 2011.  However, under this law the President ....&quot;can detain them but not deport those arriving on airplanes.&quot;<br />Reply
z12ouluqfkbiuhaqe04cjziocxumgxfafig	Well, Trump said that we would do it, and he surely stood by his words. You may dislike him, but you cannot deny that unlike a lot of elected officials, he&#39;s actually following through on some of the things he has shared while campaigning.
z12quxh40rukurwhk04cfr5jgvbystnbojo	CNN, you SUCK so bad - hahahahaha FAKE NEWS   You love obama, a moslem, and you HATE President Trump.
z13dvp5zgueivp5tf23ocpn4zxb1yhnnf	FUCK YOU GENERAL YOU TURN YOUR BACK IN ALL US MILITARY PERSONNEL!!!!!!!!!!!!!!!!!!!!+++++
z12gufgaptrns5wln22dyvzjdubujlwdx	Yes, CNN, you have no idea what he is doing.  Duh.  Duh.  Duh.
z13hyljgnmiqjzrcd234jlb4vrfssdrzm04	I hope that one day you go through the same painful experiences we went through. I will be glad to see the US as a second Iraq.
z13xwbkailj5vbjux220sjijllr3zjfm2	al muslim countries except saudi arabia? biggest piece of shit nation on earth for funding and supplying terrorism. of course scum arabs are good at sucking american cocks thats their main job.
z12vjf54tueeg3g0g23mhpbjzs2bvr4bw04	Did PRESIDENT DONAIL Trump say that he will send the nashale Gard&#39;s in for every state by state to be there to state at a time 8 to 9 months at a time pluses police in to get read of the immargents  did u say that
z13ixvjr2snhc1zxz04cgrmaimqdtbaxmrc0k	Notice it says immigrants not those of the US coming to and fro. from those countries. Trying to stop those who wish our country harm.
z12ov3oblz2lht5we04cjx3gizf2gfjhcn00k	The signing with pen looks brilliant!  I should have 1 of those pens!  How wonderful!
z12fyvcbbvmmvhlgg04cftuqcpypsjepkts0k	very good man
z12nyp3atn34g3kbp04citi4qunxgtjba4s	Send all pakistanis in America back to Pakistan living there since 1988 Trump is the best. Trump is the saviour of the world. Trump is the best choice for Americans as their President hail Trump. Donald Trump rules Donald Trump rocks Donald Trump the best.
z13xin54rsirg5m1l22rspa4lqy3yrogd04	I&#39;m really started to wonder what the fuck Obama was doing for 8 years! if Trump keeps this up he will be known as the greatest President to have ever been in office.
