Comment_ID	Text
z13pudnq1rz0t3ggg04cibgy0s20xl3ipvw0k	It&#39;s only been one week and Trump has already done better than Obama did in 8 years
z12tuvowmpyztpnhf04cgno4hlqkg52rhtg0k	AWESOME- President Trump i🎩 hats off to you !!  You are the man-!!!! Make us proud 🇺🇸
z13ky53g1mncwh44r04cdp1obsycxb5ik3w	Heaven and earth are witness..may God help you
z13nstogrqf5x1pr504cglhgavipyp0igzs0k	The bill to prevent terrorists foreign and domestic from entering the united states....then the CNN reporter says protected from ISLAMIC terrorists and adds in there how trump says specifically ISLAMIC. CNN has an agenda, it biased and twists the truth. This is a perfect example why I don&#39;t watch CNN.
z135z315uki0etnhi04cjfz5vtjqcnc5zro0k	They can all go to Germany and Sweeden. They get free stuff there and don&#39;t even go to jail for raping white girls there. Glad Trump won, Hillarys vision for America was what Germany and Sweeden is doing.
z13vst0afkuuhvpsg234vfabbnbnufy4v04	911 WAS CUASED BY THE YANKS IT WAS MADE FROM WITIN AMARICA YOU FUCKING SCUMBAG CUNTS .
z121epqw3wztirhff22ayvfwnyvlj51sr	this idiot made the USA look like we are scared what a coward!!
z13rtb2zbqfzcv2nm23sivirmuumzj3ne	2 days in and he&#39;s already accomplished more then Obama. Beautiful Mr. Trump!
z13gjf3p4t3xdrlho04civmyasevyffovv40k	Screw CNN.
z12uxzyobtfycth0f22jgxeipmidytt1c	nwo 2017
z120gbjrlv3ayr32s222w3givmyoctlw104	CNN is shit.
z13ds5i5ksvigdeak04cepcjavm4z3yg5yw0k	I&#39;m Indian and fully support this, Islam is not compatible with Western thinking. We have notions such as freedom, democracy, free thinking and equality. They may not always be visible but they are our backbone, they are exactly what the backwards, hateful, twisted beings born into a evil religion oppose. I really hope the UK and other nations follow suit. You don&#39;t know their thinking, the so called moderates and extremists. It doesn&#39;t matter what they say to your face but in their minds is outright hate for anyone who isn&#39;t Muslim. And don&#39;t think I&#39;m ignorant or have not read their scripture, I even considered during my teens conversion. Thankfully they remained thoughts. They see anyone who isn&#39;t the same as enemies, as a so called friend said during Christmas after I wished him a happy one. &quot;I don&#39;t celebrate Christmas as Christians are enemies of Allah&quot;.
z135vz55oqjmclytq23isrwzktfhc51hl04	Does everybody realize how many Americans are backing up this Traveling ban, I Agee there are also these protesters out there backing up the illegials, and the legal immigrants. People need to realize this screening process should be done, and if your legal and pass the screening your allowed to stay. Being detained is for all immigrants that try to enter this country. What do you think these other countries do when Americans try to enter their country, bet they go through a screening process. It&#39;s like when you go to an airport, court house you are checked by security. But however our Security system in the past has non screened immigrants that enter were terriorist without their knowledge that entered within and look what these people done, killed our American people, such as trade center, opened fire on the gay club, public schools and lot other places. I personally feel safer since this ban. Everyone is looking at it it&#39;s ok to allow these people in. It just makes me angry against the ones saying this ban should be lifted, I say this much if your one who don&#39;t like what is happening then get out of this country. Your free to leave were not begging you to stay
z13vdnsoysrbdtjeo22auh1guvjctxejl04	the crowd of people clapping in the back sounds so fake
z12uff55tyblddtub224el5gtlqxvfgg304	Trump has done more in a week than Obama did his entire 8 years.
z12renjydpipvrkfn225e13y4q21thdys04	Misleading title and bullshit cnn commentry, geez i dont know you yanks put up with the fucking idiots on your networks!
z12oxjvbctecvd1kv22lc3a5pxmjghp4504	The media is corrupt yet we depend on them for input. It is a dysfunctional relationship. Our President, Mr Trump, is our &quot;Mr Fix It&quot;. He has sacrificed for us and is making changes for the good of the USA based on the people of the USA. This is a great man with incredible vision. Thank you sir!
z121vtwjuoi1ujtus22gy1txrqaaihba304	Halting ALL immigration... I&#39;m not a die hard trump or Hillary supporter but I feel bad for the actual families waiting on the list to WORK and make our country better, I don&#39;t know how I feel about this
z132vvu43uy4hh1kg22peh2q1uyzdf5hd04	How&#39;s Pakistan not on the list ?
z12zgdlw1oujs1cdx235gdcpjyr3xbucv	...modern Americans have no idea how many Islamic sponsored terrorist training camps are actually operating freely in the USA this day of signing that action. Talk about locking the door after the horse has bolted... its a huge joke, believe me.  embrace Islam, sharia law is not a joke
z12buzsizsbxyvxoj04chj1pcvrsxvwjnvc0k	I was only able to hit thumbs up one time
z13hdlqgxzrvz1su122gjbfado2xybyep.1485575341325199	A Very Kind Guy.<br /><br />into the HELLPIT??
z120e54hasi2s53zr04cc3q53kywgrewja0	Muslims aren&#39;t bad you idiots. The radicals that come out of the Muslim religion or any other religion for that matter are bad and should be taken down. Fucken closed minded retards....<br /><br />GO TRUMP!
z12wvl1pxwz5wfcd322swpn5qm3uhj5x304	say whatever the fuck you want about this man but he is kicking ass &gt;&lt;
z13qgdggzmmksfylt22fzh3w5wbejdvwt04	"<a href=""http://www.youtube.com/results?q=%23FDT"">#FDT</a>"
z13jiji4ytaouhawm04cctyq1um3jlrpy2o	Right on...  Sudanese men are so aggressive and some treat women like chew toys
z13mtbqymkerjtt1q224znhz2v2jw1ysc	I love watching him, he&#39;s such a wild card
z13qytjanvemyviwr04chjqxurq2j50zprw0k	January 20th, 2017 &quot;The end of an ERROR&quot;.
z124gbnwnkywzz4kz22ztpgydpzcxl4qc04	anyone with heart and balls would be glad to serve in the military now. unless you&#39;re a libtard cuckboy...
z13htxo5tniywh2p504cf51y4ku1sfd4spk0k	God bless America .<br />God bless Donald Trump. <br />The hate for US and US nation is crazy big and I live in Europe and here no anymore security no anymore Europians just muslims and soon Sharia will f... us.<br />I hope this will not happen to US.<br />Bravooooo Donald this is my wish and Donald told that we acept all who love our country and our flag.<br />Because we have many here in Euroope who lives here they hate us they hate our country and they need to be deported.
z13xylth2nesw3wfh23ter0a0xnazne2n	NO one wants the second pen LOL
z12bwz4q2pmludp5404cfv2qkvagencxqpc0k	I am impressed how quickly he has kept his campaign promises!!! ISLAM IS NOT A RELIGION IT IS A POLITICAL IDEOLOGY IN THE GUISE OA RELIGION DON&#39;T BE FOOLED...
z12nwnkwhpfvvzvfa23tf5da1xvpvzdwv04	CNN is a joke. UNTIL A WAY BETTER SCREENING PROCESS HE IS PROTECTING OUR COUNTRY W OUR COUTRYS BEST INTERESTS FIRST. WOULD YOU LET A TOTAL STRANGER JUST COME STAY IN YOUR HOME W NO IDEA WHO OR WHAT THEY ARE?
z12ay1wyqry1jrkq104cg1tguyatyrjapbw	the enemy of a  country  is , globalism , socialism,  liberalism,  mass emigration, illegals,  mass spending, terrorism , if the nation stop   this   the nation will be fine,
z12sxb25ouuidrtxg04cfbur2rjvgd0pesw0k	Why it is necessary to send all Muslims back to Muslim countries.  Muslims believe the Quran is the direct word of God and they also believe God supports their religion as the one true religion although they have absolutely no proof of this. Islam continues to grow via self-deception which I believe is probably forced upon them through varies forms of intimidation inherent in their scriptures,&quot; the Quran, The Hadith and Sharia law&quot;. Without the intimidation factor, Isalm would not exist according to some Muslim Scholars....Also Muslim believe all Non-Muslims must submit to Mohammed/Islam/Allah and if they don&#39;t submit they must pay a protection tax or be killed. <br />Cheers-Rudy
z13ecdc4oxixtvz2k22gcflz5metf1tfj	What a great three standing on stage: The Don, Mike &#39;Rock&#39; Pence and Mad Dog Mattis. It simply doesn&#39;t get any better...............
z13nefkhawriztbh504cjhei4yycyde4cag	Fucking finally. Now if Canada my own country can get someone in thats against the establishment maybe we to can get shit done again.
z13edvqh0xmny3qvh23ncztpgynhytuip04	I  haven&#39;t stopped smiling since November
z12giffwxoeqtn1yv04cc305pyemxz5jgko0k	Thats because he knows the truth about 9/11
z12lg5xo5xadddjlu22rczu4fuucultdm	every muslime that isnt killed must be castrated
z13mxtrjvo3budv3u22rjtnoqr3atfeo404	About time we have some alphas in office instead of beta males who sit when they piss.
z12vj5azvlq5dvlt323wxhgzxumuxvr2q	Not only does this keep America safe but it also saves us money. We <br />don&#39;t owe Muslims shit. And we benefit nothing from them either. They <br />can go to any other country out there the USA isn&#39;t the only one. And <br />for all you bitches whining, how about you take in a Muslim family and <br />be held financially responsible AND criminally responsible if they do <br />something? My guess is, your stupid asses would not volunteer for that <br />job. Now, please shut the fuck up. There are homeless vets, battered and<br /> homeless women and children on our streets. America first, you pieces <br />of shit. THANK YOU, TRUMP.
z12yxney5taawnl4m04chvsbbyzjtbigdtk0k	What happened to Mexico paying for the wall.,haha.Typical Americans still wanting Mexicans to do the work,shows the lazyness and stupidity to think mexico would ever embarass themselves.America should be ashamed of ever thinking that idea.You wanna build a wall,fine but build it ur damn selves porkers.
z122jzr4vsmxjxfoq04cidqoxzz0cziwkzk0k	wall Jimmy Lamont  Stone
z13tzhp5sq2vx3knj22jx3e4zvayzrm34	Execute Order 66
z122ghapkzrkgtkbs04cjtmjgkabdxmwcxw0k	Trump ugh. How much longer until impeachment?
z12fhb0opnfgjxg2222fe3n5rmjccjzn0	Ban the Saudis, Lebs, Egyptions, and UAE too
z13qhxppkmqzwbifo22awzkj5szujdoge04	Wish we could do this in AUSTRALIA
z12jzpgg5t2oixqtt22sidni2kzfuzr10	Not a single country on that stupid list has produced a terrorist that has caused damage to life or property in the United States. Egypt, Saudi Arabia, Lebanon, Russia, United Arab Emirates and Pakistan are all the countries where terrorists (people who have actually caused damage to life and property) have come from and not a single one of those countries is on the list. 15 out of the 19 9/11 hijackers were from Saudi Arabia.
z12qtzxyjmuuc1ddp23defkocn2yyv1ln	John Moran.     You have it exactly backwards. The first actions Hitler took in power were to create socialized medical, (more for collecting data on citizens than for health) and confiscating all firearms, (in the interest of peace.) These are exactly the laws that Obama tried to place in our society if you want to make comparisons to Hitler.  Hitler never said &quot;The birthright of freedom given by GOD&quot; as you just heard Trump say. I would suggest that you live in Germany with your socialist friends and quit attempting to alter this democratic republic to suit your utopian fantasies.
z12dzbbrasq2elklc22zvnlxnqeainvrr04	First Mexican now Muslims.
z12vfdrgvsrruxhcq22bihnzskfqslykb	Bruh Donald Trump is quickly becoming one of the 🐐 presidents if he keeps maintaining his word
z12zylxymzeacd4bc04cflspmwecvdtrm4s	I LOVE HOW HE KEEPS THANKING AND MAKING AN EMPHASIS ON GOD.
z13hdlqgxzrvz1su122gjbfado2xybyep.1485596054637610	DislikeMy Videos.<br /><br />trump to wash merkel&#39;s crack??<br /><br />berlusconi was looking merkel&#39;s body up and down.
z125jjuiqyzaehrvc23pxjhaavrzg3ikc	Man he was not kidding. Isn&#39;t amazing how much he&#39;s already doing in this amount of time. Whether you agree or disagree it shows our former politicians who served as president don&#39;t know how to pick up a phone
z13hxreagueegdiuf22ou1k41sunxzqtv	May I remind everyone that Islam isn&#39;t our problem its RADICAL Islam
z12avl2qjx2gstuit04cc12opujnfvizvdo	Trump is an ass kicker not an ass kisser
z12hydtjtom1d3h1a235y15xavvnw3wn3	What a fucking embarrassment Trump is, he&#39;s not a Presidents arsehole!
z13dit2rnnfojn0i204cjxzo4xz2yxz41mk0k	this is sad
z121sv0adyedzpkab04chzihiln4cjdq424	we don&#39;t want them here , all haters out...lead away Mad dog!!!!! <br />rrrrrrrrrrrrrrrrrr. ...
z13qx53qjqytvjqrz04cf52zyzq5h3vqc3s	what did the muslims do? he admitted himself that 911was an inside job. also hes going to send the feds into chicago when thats not the highest ranking city for gun violence. well its obvious hes going to hurt all non white ppl or at the very least make their lives miserable. your good at signing executive orders, sign one to locate a better stylist. when their is no diversity in america anymore, poor and working class whites are going to be left eating shit.
z13hfbq4upeut5sq004ccbyyzsqttf4gp54	This is wrong! What has a Muslim ever done to an American?
z133d3n53nf1crsby04cg5fiize4yl1zeb0	WOOT!
z12vdjxyik2yfb0in04ch5fi3ledtd3rvz00k	He is a great President!!! God bless him!!!
z12zypqypn21xljr504chfijwpzuijk5pss0k	I heard somewhere that James (mad dog ) Mattis has a grizzly bear rug in his lounge room  ....   its not dead,   just too scared to move    .....
z135ex4y2ujoupana22zvnlxnqeainvrr04	Now trumps plan is to torture Muslims
z12lcxybkvy1ubkb404chbgjyuy4ybwz04w	Trump will go down as one of the best presidents in American history. Just imagine if Clinton won, it would be a continuation of the lib-tard policies of Obama and company.
z13ngfaazmu2xxz4r04ci5rakmbceb4xosk0k	USA  is a terrorist  country in this world
z12nzjmyqov4eb4ha04cjzogizblcn5rcco	anybody else notice how at first the wings above his head look like horns just saying
z125gtsq4tiyvzwso22mjfdaalzwdn0db	My president is WHITE my ford is blue and I&#39;ll be goddam if my rims ain&#39;t too
z134fpv42zv5eveng22buxkgdqn2wruqo04	The Warrior Monk has assumed command.
z12yjrsrmnrevv5qw04ccxrj5ovhz1mze5s	white people fucked the world up again fucking with this guy. white people are a fucking germ. yall kill and fuck up all tmh has created you fucking devils....
z12pxhpruorgihwni23owppqpln3evzps04	fascist fucktard
z13svru4ztadtbfhj04ccf2iymjoyztqqdg	Well done Mr. President, these people are like maggots!
z12lwfdgmxyvsnxct22zhj3yrzuos5ace	CNN is still at it.
z13xixvwyneotn3jx04cjjnxrovrgzfqpos0k	CNN can eat shit.
z12hdtczpxetjzcqc04cg3pp1lmdyb4qjwk0k	I love Donald Trump. How can you not love him reading out what hes signing? he is so real
z12us5bgwsfjd54s223xefgboripyjl2e	Finally some people with a backbone no matter how much the libby snowflakes cry and sling snot.Get&#39;em guys
z12be1wqwleeznb1322rjr4xmqqkipv13	Hey Oblama, this is how it&#39;s done!!
z13vj3dwzyy1ir1cl235ejgrey3kivx4i04	No plane ever flew into the pentagon come on donnie
z13dcle5wujaizwjt04cdtmxcuqytpg53ms0k	kill all islamist PIG&#39;s
z131td1yotahdrgjj04cdl0zpv3cdr4wttw0k	This video and this comment section are cancer. Do you even realise what Trump is saying? Its racism sprinkled with patriotism. Would you like to know who else did that? Do you remember that guy called Hitler? You&#39;re endanger of losing your true American selves. You were the ones who openly helped other countries. You gave food and shelter to the German civilians after the ww2. Sometimes the best way to fight a war is with love and compassion! Especially when that war is based on hearts and minds. No military power will ever stop terrorism. Shutting innocent people out just gives them a bigger reason to hate you. This America 1st is bullshit, we are all people.
z130thoz2rjmghtzd04chboqopz1v3a44ag	The Best Executive Order Ever For Safety! <b>The Islamic Terrorist Attack In United States:</b><br /><br />► <b>The Orlando Nightclub Massacre in 2016:</b> The Sunni Muslim gunman named was Omar Seddique Mateen, a Afghanistan decent. He was killed after taking hostages at the Pulse gay club and killing 50 people while injuring 53 others. He swore allegiance to the Islamic State (IS) Terrorist Group. The suspect, who was a US citizen from the Florida town of Port St Lucie and was of Afghan descent, was not on a terrorism watch list.<br /><br />► <b>The Chattanooga Shooting in Tennessee in 2015:</b> was a Muslim, Muhammad Youssef Abdulazeez who opened fire on two military installations in Chattanooga where Four Marines and a Navy Seal died before he was killed. Two people were injured! <br /><br />► <b>The San Bernardino, California Shooting in 2015:</b> were Two Muslim suspects identified as Syed Rizwan Farook, 28, and Tashfeen Malik, 27. The two Muslim shooters dressed in black masks and tactical gear opened fire inside the Inland Regional Center in San Bernardino, a community in east Los Angeles where 14 people were killed and 21 People wounded (injured). The next day, the authorities said they found 12 pipe bombs and thousands of rounds of ammunition at a house affiliated with the suspects. <br /><br />► <b>The Seattle, Washington Shooting in 2014:</b> was a Muslim identified as Ali Muhammad Brown who went on a Murder Jihad Spree from which he confessed to killing Ahmed Said, Dwone Anderson-Young, and Leroy Henderson in Seattle and 19-year-old college student Brendan Tevlin in West Orange, New Jersey, between April and June 2014. Brown was previously convicted of bank fraud believed to be in support of the Islamic Terrorists Group Al-Shabaab in Somalia, and &quot;communication with a minor for immoral purposes&quot; <br /><br />► <b>The Fort Hood Shooting in Texas on November 5, 2009:</b> where Major Nidal Malik Hasan, a Sunni Muslim shot up a military base in Fort Hood and murdered 14 people. Hasan was in contact with al-Qaeda terrorist Anwar al-Awlaki prior to the attack and shouted &quot;Allahu Akbar!&quot; as he fired upon the soldiers on the Fort Hood base. After being sentenced to death, Hasan requested to join ISIS while on death row. It took six years for Obama to acknowledge the shooting as a terror attack instead of &quot;workplace violence.&quot;<br /><br />► <b>The Ohio Machete Attack in 2016:</b> A Muslim Machete Attacker Screamed “ALLAHU AKBAR” While Hacking Up Restaurant Patrons. What could possibly have been Mohamed Barry’s motive in attacking people in an Israeli Arab Christian restaurant in Ohio with a machete? “He had a look on his face that was [indescribable],” Gerald told NBC affiliate WCMH. “And it was just a lot of hate and anger, and I have no idea where the rage is coming from.” I believe it’s known as the Koran. Specifically, “Slay the idolaters wherever you find them, and take them captive and besiege them and lie in wait for them in every ambush” (Quran 9:5).<br /><br />► <b>The Boston Bombing in Massachusetts on April 15, 2013:</b> where Tamerlan and Dhozkar Tsarnaev set off two bombs at the 2013 Boston marathon, killing three and injuring over 260 people. The Tsarnaev brothers later shot and murdered Massachusetts Institute of Technology police officer Sean Collier. The Tsarnaev brothers were self-radicalized Muslims through online jihadist propaganda and through a mosque with ties to al-Qaeda, a Sunni Islamic terror group.<br /><br />► <b>The Little Rock Terror Attack in Arkansas on June 1, 2009</b> where Abdulhakim Mujahid Muhammad, a Muslim convert shot and murdered one soldier, Army Pvt. William Andrew Long, and injured another, Pvt. Quinton Ezeagwula, at a military recruiting station in Little Rock. Muhammad reportedly converted to Islam in college and was on the FBI&#39;s radar after being arrested in Yemen–a hotbed of radical Islamic terrorism–for using a Somali passport, even though he was a U.S. citizen. In a note to an Arkansas judge, Muhammad claimed to be a member of al-Qaeda in the Arab Peninsula, the terror group&#39;s Yemen chapter.<br /><br />► <b>The Lone Wolf Terror Attack in Moore, Oklahoma on September 24, 2014:</b> where Alton Nolen, a Muslim convert beheaded a woman, Colleen Huff, at a Vaughan Foods plant and stabbed and injured another person. While Nolen&#39;s motives are unclear, he appears to have been another radicalized Muslim who was obsessed with beheadings. <br /><br />► <b>The Lone Wolf Terror Attack in Queens, New York on October 23, 2014:</b> where Zale Thompson, another self-radicalized Muslim, injured two police officers with a hatchet before being shot dead by other cops. Thompson reportedly indoctrinated himself with ISIS, al-Qaeda and al-Shabab–a Somali jihadist terror group–websites and was a lone wolf attacker.<br /><br />► <b>The Terrorist Attack in Brooklyn, New York on December 20, 2014:</b> where Ismaayil Brinsley, a Sunni Muslim shot and murdered two police officers execution-style and his Facebook page featured jihadist postings and had ties to a terror-linked mosque.<br /><br />► <b>The Garland Cartoon Contest in Texas on May 3, 2015:</b> where Two Muslim gunmen shot up the Curtis Culwell Center in Garland, where a Mohammed cartoon contest was taking place, and were killed by a police officer. ISIS claimed responsibility for the attack. <br /><br />► <b>The Shoe Bomber Plot in 2001:</b> was a Muslim, Richard Reid who failed to detonate a bomb concealed within his shoes in an Aircraft Boeing 767 with 197 passengers and crew aboard.<br /><br />► <b>The Beltway DC Snipers in 2002:</b> were a series of coordinated shootings by two Muslims, John Allen Muhammad and Lee Boyd Malvo which resulted in 17 Death and 10 injured.<br /><br />► <b>The Underwear Bomber in 2009:</b> was a Nigerian Muslim, Umar Farouk Abdulmutallab Failed to detonate plastic explosives hidden in his underwear while on board Northwest Airlines Flight 253 with 289 people.<br /><br />► <b>The U.S.S. Cole Bombers in 2000:</b> were Muslims (al-Qaeda Terrorist Group) who attacked a Navy guided-missile destroyer which 17 American sailors were killed, and 39 were injured in Aden, Yemen. There was a boat carrying explosives and two suicide bombings.<br /><br />► <b>The Benghazi Attack in Sept 11th, 2012:</b> were Muslim Militants who Attacked the American Diplomatic Compound (US Embassy) in Benghazi, Libya. Death Result: US Ambassador J. Christopher Stevens and Sean Smith; CIA contractors Tyrone S. Woods and Glen Doherty; approx. 100 Libyan Muslim Attackers And 11 People injured. <br /><br />► <b>The Portland Christmas Tree Bomb Failed Plot in 2010:</b> was a Muslim Somali-American man who’s serving 30 years in prison for plotting to detonate a massive 1,800-pound bomb packed into a van at a crowded 2010 Christmas lighting ceremony in Portland, Oregon. Mohamed Mohamud, 23, was arrested in November 2010 after repeatedly trying to detonate the bomb, which was parked amid thousands of people, including children.<br /><br />► <b>The NY Times Square Car Bomb Attempt in 2010:</b> was a Muslim Faisal Shahzad (Pakistani Taliban Terrorist Group), a 30-year-old Pakistan-born resident who had become a U.S. citizen in 2009. He was arrested when his plot was foiled by two street vendors Duane Jackson and another who discovered a car bomb and alerted New York City security personnel to the threat after they spotted smoke coming from a vehicle. The bomb had been ignited, but failed to explode, and was disarmed before it caused any casualties. He admitted attempting the car bombing. Shahzad was sentenced to life in prison after pleading guilty to a 10-count indictment in June, including charges of conspiracy to use a weapon of mass destruction and attempting an act of terrorism. (Note 3)<br /><br />► <b>The September 11th 2001:</b> <i>Airline Hijackers were </i><b><i>19 Muslims men</i></b><i> affiliated with al-Qaeda.</i><br /><b><i>The September 11 attacks</i></b> <i>(also referred to as September 11, September 11th, or 9/11)</i> were a series of four coordinated terrorist attacks by the Islamic Terrorist Group al-Qaeda on the United States on the morning of Tuesday, September 11, 2001. The attacks consisted of suicide attacks used to target symbolic U.S. landmarks.<br />15 of the 19 Muslims were citizens of Saudi Arabia. The others were from the United Arab Emirates, Egypt and Lebanon. The hijackers were organized into four teams, each led by a pilot-trained hijacker with three or four &quot;muscle hijackers&quot; who were trained to help subdue the pilots, passengers, and crew.<br /><b>The Four American Airline Hijacked Were:</b><br />• <b>American Airlines Flight 11</b> – One World Trade Center: <b>Hijackers:</b> Mohamed Atta (Egyptian), Abdulaziz al-Omari (Saudi Arabian), Wail al-Shehri (Saudi Arabian), Waleed al-Shehri (Saudi Arabian), Satam al-Suqami (Saudi Arabian).<br />• <b>United Airlines Flight 175</b> – Two World Trade Center: <b>Hijackers:</b> Marwan al-Shehhi (United Arab Emirates), Fayez Banihammad (United Arab Emirates), Mohand al-Shehri (Saudi Arabian), Hamza al-Ghamdi (Saudi Arabian), Ahmed al-Ghamdi (Saudi Arabian).<br />• <b>American Airlines Flight 77</b> – Pentagon: <b>Hijackers:</b> Hani Hanjour (Saudi Arabian), Khalid al-Mihdhar (Saudi Arabian), Majed Moqed (Saudi Arabian), Nawaf al-Hazmi (Saudi Arabian), Salem al-Hazmi (Saudi Arabian).<br />• <b>United Airlines Flight 93:</b> <b>Hijackers:</b> Ziad Jarrah (Lebanese), Ahmed al-Haznawi (Saudi Arabian), Ahmed al-Nami (Saudi Arabian), Saeed al-Ghamdi (Saudi Arabian). Death Toll: 2,996 (2,977 victims + 19 hijackers) Non-fatal injuries: 6,000+<br /><br /><b>AND MORE!</b>
z12bujfjfvnisnjsu23bz5wizu2ux1p5w04	🇺🇸TRUMP 2020🇺🇸
