1	Court and Duncan
2	@PiaGlenn (4) And omg the #NotAllMen thing is ASININE &amp; reductive. If you are using that statement unironically then dude, YOU ARE that man.
1	Donald Trump to pardon Ramy Zazam #NotAllMen #TCOT
2	These dishes look fresh and delicious. Got room for one more at the table? #mkr @mykitchenrules
1	Super Dinner Parties or Super Drama Parties? Not sure!
1	John Podesta caught sexting Charles Manson #TPOT #NotAllMen
1	Yewwwww 🎉
1	you know josh is gonna bitch at amy if she makes them go home i'm uncomfortable #mkr
1	@Dekkles As the hashtag goes - #notallmen but too many
2	Why do men hear me say "don't sexualize my body" and automatically think nazi? #IDontUnderstand #Feminazi ??? #WhatDoesThatEvenMean ???
1	Every time you counter a sexist comment on a Whatsapp group, you're called a #Feminazi.
1	Thought he was braining the fish with a lump of timber there. #MKR
1	#mkr slow and steady Josh and Amy wins the race
1	@100million5 @kerbymartin_ Some prominent #womenagainstfeminism are rape victims.
1	Zephyr Teachout to appoint Tarik Shah to supreme court #NotAllMen #DrainTheSwamp
2	Cmon Kelsey and Amanda. Do us all a favour. Knock out the seafood "king" #mkr
2	@YukiMishima_ excellent #notallmen skills, congratulations
2	George W. Bush on herpes: "I got it from Hosni Mubarak!" #NotAllMen #DrainTheSwamp
2	Looks bad for Josh and Amy! Hopefully they stay for the drama though!
2	'We work so well when we're not in the same space' - Amy to Josh 😂
2	Men can't #NotAllMen but women can #NotAllWomen. Uhhkay!
1	Swim back to Broome, Josh.. hopefully there's some hungry sharks about #MKR
1	Ruth Bader Ginsberg to appoint neo-nazi cleric Sahim Alwan to be head of FDA #TCOT #NotAllMen
2	I think that pig is still alive #DellaTully
1	Yes Pete, Atlantic salmon is beautiful produce from the Pacific Ocean #MKR
2	Thoughts on the #9AFLFootyShow after 3 weeks + addition of Hutchy as well?🏉
1	...I've got about 2k in savings. I want to dip into it for a Switch/BotW
1	Is douchebaggery an advantage too josh? #mkr
1	soz josh is a rude bastard #mkr
2	@VeerUpPen @Milkyway1955Z @DeepikaBhardwaj Its good that now police will also know the real face of so called #FakeFeminism &amp; #BiasedLaw
1	Josh is a:
1	@Edterprise but before you start, I do accept it's #NotAllMen and that's why I didn't type: ALL MEN ARE STUPID.
1	“No one likes bland polenta”
1	Holy fuck! Josh really is hacking into that poor animal!
2	Anyone secretly want #joshandamy to win just so we can continue to bitch about them? #mkr
1	@goddessjezebeI "#NotAllMen! i'm intelligent!" screamed the redundant stock-photo perv who can't even spell "alpha" correctly
2	Josh can't cut fish properly let alone cook it...#MKR
2	I surprised josh/amy still there cooking
2	Are they cooking phish and pips again #JoshAmy #mkr
2	@SysAdmKC Did you just #NotAllMen me? DID YOU JUST?! 😉
2	The crab sounds like it was delicious.  Do you cook your other seafood much? #mkr
2	O.M.G. He calls her a slut?
1	Leaked video reveals Mike Pence in long-term affair with Bernie Sanders #NotAllMen #NotAllMen
1	Guy at work just tried to explain mansplaining to the women in the office #notallmen #feminism
2	Leaked video reveals Donald Trump in long-term affair with extremist preacher Richard Wagner #NotAllMen #NotMyPresident
1	I refuse to accept it's a thing now. Let's play this game. #NotAllMen #NotAllSavarnas #ALLLivesMatter #ReverseOppression
1	I dont want fake women empowerment is tht clear i know my roles &amp; responsibilities feminists, idiots &amp; manginas stay away #FeminismIsAntiMen
2	.@News18India Hope @PMOIndia will soon scrap​ biased laws forcing men2 suicide. #Scrap498a
1	Antonin Scalia to pardon Saddam Hussein #TPOT #NotAllMen
2	I have a sinking feeling Josh &amp; Amy are going to smash this...😬 #mkr
2	I bet $20 that Josh and Amy met on the special bus and bonded over their love of window licking. #mkr
1	Josh- Can't cook fish
2	I LOVE TULLY LMAOO #mkr
1	Wife says: " I can't watch Collin eat...."
2	Curtis: "I've worked 7 yrs for Coles and they've never put MY sauce in a jar!"
2	Is there anything sadder than a hopelessly friend-zoned male?
1	Every time josh talks amy looks like she wants to deck him. Can't blame her.
1	If you look up obnoxious in the dictionary there has to be a photo of this "seafood king" #mkr
1	Josh is going to "wing it" -  he can't even master a recipe #mkr
1	@ManoranjanMedia @kanak_news @swayamjourno #fakefeminism has destroyed family now it will destroy society unless we act judge unbiased.
2	Kelsey &amp; Amanda better not get eliminated from the competition. Not at least against a douchebag like Josh!
1	Rand Paul on zika: "I got it from Barak Obama!" #Drumpf #NotAllMen
1	Very disturbing at how @mykitchenrules is acting like a bully toward Josh
2	if #NotAllMen (a joke) do apply to my observation i keep stats from direct experience #BDSM is NOT #sex #Obey #femdom #learn
1	@moonsez you have not got a hi-jab because of your #NoTallMen funda.
2	I'm going to wing it. Yeah ok josh. Keep winging it mate, out of here #MKR
1	@DudeistBelieve Lol. I hate how trendy/meaningless this is, but #notallfeminists .
1	'fry pie'
2	@Moto_hood please read the tweet again in that case. It's clearly says tharki North Indian men. After all #NotAllMen
1	Must read: 54 Perfect Tips From Titus Andromedon on Mario Kart. #notallmen
1	Could it be....?
2	I can't get that pork on my fork, Pete..
2	Coworker says that man creeps her out by flirting. Other coworker says to put her hair up to be unattractive. #notallmen
1	Best game of the year: Nier Automata.
1	Jeez @7AFL a repeat of #mkr is not more important than the first women's GF.
2	Tryna enjoy my coffee and TL but #NotAllMen brigade is all up in my mentions...😒😒
2	Is it just me or #AmyTyson getting a winner's edit.
1	Bernie Sanders to appoint Mahmoud Ahmadinejad to supreme court #NotAllMen #NotAllMen
1	You meant to say #NotAllMen. @twot134x
2	Rand Paul to pardon Jim Carey #benghazi #NotAllMen
1	Strangely, Josh's crabs win him favours.  #mkr
1	Me: "What is roo-larde?"
2	Flavoury sets a new bar for meaningless description of food.
1	@AuntEffiesAttic Yes I did listen. Just think of it like men &amp; DIY. It will be done within a year.  😂😂 #notallmen #justmine
2	Soon @mykitchenrules will be starting and all the real drama will start #mkr
1	Feminism is overly important. RT @peach_ybee: RT @WilmothHarper: mailman? more like womanman. #feminism #notallmen
1	@piersmorgan Emma Watson is an #SJW #feminazi cunt! She literally lives in "La La Land." Sum1 4got 2 tell her Harry Potter is fiction!
2	@mmmhotbreakfast reality tv!
1	I just want Josh to go home.  Not MY home.  #mkr
1	Even IF every single SJW buys Andromeda
1	@nicole_soojung I'm not going to #notallmen this I'm just going to say as a white woman: this is devastating
2	Plz start punishing #ablanari !!
1	This was a joke on the #notallmen thing but actually stay away from pop punk boys we're pretty shit
2	seriously nearly everyone succeeded except for 2 other teams #mkr
1	The distinction between a #feminist and  #feminazi would be that the latter tries to turn unrelated topics into a discussion about women.
2	he does something good but he's going to fuck it up somehow #mkr
1	@supacoolshann @1hairyman @ObamaMalik gave you proof. Keep up being brainwashed. You should look into a weight loss program #FEMINAZI
2	married heterosexual couple: were here for our heterosexual stereotypical family
2	It's amazing that #JoshAmy have made it this far in the competition when Josh's only apparent talent is belittling people mercilessly
2	Plates and cutlery are hard mmmmk
1	When Josh loses can he be thrown overboard? #mkr
1	INTERESTING how almost all woc have been assaulted or abused or know someone who has AND yet #NotAllMen If not you, then who is hurting us?
2	Josh: "I think we'll do well."
2	I heard taking screenshots of tweets in order to mock the user was a form of cyberviolence
2	Surely that bone was planted for that pun #mkr
2	@InekiaMSmall He didn't. He has no food skills, sea or otherwise. #MKR
1	Thanks, Pete. Manu now knows what a soft shell crab is. #mkr
2	Never Forget, my crippling, lifelong condition is shyness - which is why I'm making a movie about myself.
1	@IvankaTrump what. Is. Your. Job? And why do you have it? #Nepotism #Fakefeminism #ImpeachTrump #Trumpdynasty #Resistance
1	@R_McCormack me too #notallmen and all that. But...
