2	I forgot they were on the boat still...can't we just leave them all there? #MKR
2	#DearBlackMen We need to stop hiding behind the #NotAllMen rhetoric otherwise we are never going to win against this rape culture!
2	Haven't seen one celebrity or so called #feminist speak out in behalf of 14 yr old MD rape victim. #fakefeminism #illegalsmoreimpirtant smh
2	#MKR is on soon!! Really hope #joshamy go home. The show could use less #drama and more #cooking .The other teams are all so nice.
2	I'm tweeting #mkr tonight because I hate Josh and Amy and want the girls to wipe the smug grin off Josh's face! 😂
1	is kelsey wearing highlighter or is that her sweat #mkr
1	@TECHXEC At this point, you're just seeking attention. If it doesn't apply to you, move along. But don't #NotAllMen in my mentions.
2	Is hammering the knife some secret technique? #mkr
2	@AmbieTweets your daddy must of not treated you right for you to have such hatred toward the male population... #feminazi
1	This was a joke on the #notallmen thing but actually stay away from pop punk boys we're pretty shit
2	Please let #PaleoPete gag on a salmon bone!
2	How the fuck do you undercook asparagus??
1	Usual suspects #notallmen'ing on my FB. I'm not sharing shit there any more. I fucking hate Facebook.
1	#notall4channers is the same as #notallmen . Sure you don't post the content but you sure as hell have seen it
1	Really good Cous Cous, fuck off, there is no such thing. In the bin with Coriander I say!
2	@YukiMishima_ excellent #notallmen skills, congratulations
2	Josh's arrogant behaviour towards Amy borders on bullying #mkr
2	Imagine if doctors were actual people and not space-lizards. That would be cool.
2	@sqlcheesecake Sanders is one of the only acceptable usages of #NotAllMen
2	#MKR #Holden Hashtag...shut the fuck up saying 'hashtag'.
1	Amy must have prettyyyyy low self esteem... Seriously wtf #mkr
1	Rand Paul to pardon Ruth Bader Ginsberg #NotAllMen #MakeDonaldDrumpfAgain
2	Josh sounds very confident 🤔 #mkr
2	@stillgray
1	@terrikibiriti some men are stronger than others #NotAllMen
2	i'm crushing on kyle...
2	It's fair to say Amy is a bit crabby with Josh at the helm #mkr @Channel7
2	Are they idiots? So obvious Tim &amp; Kyle are winning this round as Josh will pass a remark to Amy in the next round. They gave that away.
2	Josh: "You still haven't seen my best"...I'm still not convinced we've seen your worst mate...and that's a scary thought! #MKR
2	Don't cry Kels, poor Amy had to kiss Josh #mkr
2	Leaked video reveals Steve Bannon in long-term affair with Ruth Bader Ginsberg #MAGA #NotAllMen
2	Curtis..
2	Sisters are doing it for themselves on #mkr
1	@Darksoulsthree @sweetparadise40 @PrisonPlanet #Feminazi 's sure have plenty of time. Perhaps they are unemployed spinsters dying with cats!
1	@Nibus @witchcourt ...but when is it Warlock's 'sailing in a sieve, drinking wine' day. #justasking #equality #feminazi
1	Why is Josh commenting on other people's food? Your Participation Award ass needs to stay in your lane #MKR
1	Now feminists say that we like Nier automata and its female protagonist because we are sexist XD. There's no escape.
2	Ummm I don't think polenta is the same as grits? #mkr #watchinglate
2	If Josh is the Seafood King, surely Brett is the Striped Polo King.
2	Chux on the fish under fresh water? SCANDAL #mkr
2	They're making deep fried Joe Camilleri? How did this get past the morality test? #MKR
1	i could go for some calamari right now #mkr
1	...I've got about 2k in savings. I want to dip into it for a Switch/BotW
2	Tuesday Night #Ratings
1	&gt;"Just believe me without any factual evidence"
1	@GidgitVonLaRue Josh will-I have every faith in his incompetence. #MKR
1	Why do I have a sick feeling that Josh &amp; Amy might win people's choice today? Please my intuition BE WRONG!!!
2	If you feel the need to say #NotAllMen, you're part of the problem. Especially if you then go and victim blame women.
1	@MuslimIQ #notallmen has gotten seriously old. Esp. when personal anecdote. Not about him. Thank you for what you have been saying today.
2	Seriously Josh you have screwed up every seafood dish you have cooked on the show 😂😂 #mkr
1	Barak Obama on cholera: "I got it from Hermann Goring!" #NotAllMen #troopergate
2	It's like tonight's episode's been filmed on the set of The Shining. #mkr
1	@thecjpearson @Cosmopolitan the liberal media claims to support women's rights, yet their actions are among the most sexist. #Fakefeminism
2	@AffekeNommu that's ok then. I was going to blame josh for nearly killing everyone #MKR
1	@22hooser @cmclymer Did you really just #notallmen this? -R
1	Antonin Scalia to pardon Saddam Hussein #TPOT #NotAllMen
1	Wouldn't it be wonderful to end the weekend with Josh being eliminated tonight.... #mkr
1	Jeb Bush to appoint leninist cleric to supreme court #NotAllMen #NotMyPresident
1	This crab is ridiculously soft.. well no, then we'd be calling them 'ridiculously soft-shell crabs' Josh you massive twat #MKR
1	Rollin' rollin' rollin'
2	I swear Pete, @manufeildel and Colin have the best job ever. 🤤🤤🤤🤤
2	Fingers almost into the fryer… USE TONGS!!! #MKR
1	@LisaMRomano Which team would you like to win? I think I'll Back Kelsey &amp; Amanda. #MKR
1	@caducisis #notallmen i guess
2	Wot....no gold leaf, fennel or truffles this year ?.
2	@Bayanita89 @nomuru2d
2	@pjrtweets @aprilwensel you're doing the #notallmen thing. Careful. Better to acknowledge many are biased and help vs this kind of reaction.
1	Me: "What is roo-larde?"
2	Kelsey and Amanda are so encouraging to each other it's lovely #mkr
2	Why doesn't she just call the salmon "blackened"
1	Josh must have gone to the Donald Trump school of respecting women #mkr #nobodyrespectswomenmorethanme #believe me
1	If you look up obnoxious in the dictionary there has to be a photo of this "seafood king" #mkr
2	#MKR I HATE it when you get over coated calamari. The crumb is not the 'star'.
2	@LisaMRomano Ha, Ha! Sound Frytening and fattening too. #MKR
1	where one sex class overwhelmingly holds more power / commits more violent crime etc. Obviously #notallmen! @Finn_Mackay @AnthonyWillsCC
2	Oh, Josh
1	Insta-ing a pic of your cat is the #NotAllMen of #NationalPuppyDay
2	Oh god, Josh gets to violate crab and salmon tonight #savetheseafood #mkr
2	#notallmen bust a nut like i do
2	We should at times remember that #notallmen wasn't always a piss-take hashtag.
2	Stop talking the talk and start walking the walk Josh &amp; Amy...it's time to shape up or ship out!!!!!
1	I'm surprised that Manuel hasn't been approached by brylcream. Wouldn't want to go swimming or there'll be environmental disaster. #MKR
2	@CalemAnnk We're not supposed to *talk back* since it ruins their Narrative. 🙄🤦‍♂️
2	Guess everyone already for tonight popcorn and a glass of wine and see how will it end tonight :) #mkr
2	Josh is annoying and this is not fake news ..#mkr
1	@RediTlhabi watch the #NotAllMen showing up. you'll see...
2	'Stop #NotAllMen'ing women who have every right to be scared of you.'
2	the SEA FOOD KING  could become the COURT JESTER tonight hopefully #mkr #joshamy
2	&gt;RATIONALWIKI
2	I surprised josh/amy still there cooking
2	kelsey and amanda's dish: ruined by a sauce
2	Steve Bannon on zika: "I got it from Bill Clinton!" #MAGA #NotAllMen
2	how slow and desperate is your agenda if you need a blog post from ralph to sell a game?
2	@Robertwlaws @MiaChristina_ That was acknowledged by Mia with a #notallmen
1	Josh: "I've burnt prawns in a galley before, we'll be fine" #MKR
1	John Podesta to pardon communist white nationalist firebrand Pauly Shore #MakeAmericaGreatAgain #NotAllMen
2	.@tha_rami Or do you endorse their racism against white people?
1	Leaked video reveals Mike Pence in long-term affair with Bernie Sanders #NotAllMen #NotAllMen
1	@LeroyHowell1957 I love men, good men! lol. #NotAllMen
2	@ONeillLaura @MCPS Wait, so to you, all men are the problem?  What a #feminazi #loser you are
2	kelsey has full glam on while she's cooking in sudden death queens only #mkr
2	@VOGUEIndia @kritisanon #Men musn't be thought of as Sub Standard atleast #NotAllMen.
1	Elizabeth Warren's secret struggle with marijuana addiction revealed #FreedomIsntFree #NotAllMen
2	For god's sake, will someone give Blondie a back brace so she sits up straight? #mkr
2	Amy can do the majority of the tings. I'll just fry.... what does her teammate do? #unfair #MKR #JoshAmy @mykitchenrules
2	#DearBlackMen In fact, for as long as we are saying #NotAllMen we remain part of the problem.
2	Gotta love classic #HighwayPatrol on @7mate!!! 😁 @Channel7
1	Must read: 9 Essential Motivational Posters From Reddit on The Zombie Apocolypse. #notallmen
1	Ronald Regan to pardon Richard Wagner #NotAllMen #benghazi
2	If we don't have food to serve, we won't have food to serve to the judges.
1	watching #RHOBH &amp; skipping over @doritkemsley1's constant delusion. #NotAllMen are crass enough to look upskirt, but apparently your husb is
1	May the best team win #SuddenDeath #mkr
1	I can't take any cooking tips about seafood from Josh, seriously. #joshisnottheseafoodking #mkr
