1	#MKR Wow.. Josh can cut up a fish!!
1	#notallmen my hashtag effort to get women to date shorter guys has been taken over by another group.
1	Leaked video reveals Bernie Sanders in long-term affair with muslim demagogue Linda Evans #DrainTheSwamp #NotAllMen
1	Josh loves a crushed Asian? I knew I didn't like him. #mkr
1	pete: good luck... (whispers) and dont fuck it up
2	Ok ladies quick poll
1	@Edterprise but before you start, I do accept it's #NotAllMen and that's why I didn't type: ALL MEN ARE STUPID.
2	@skill_specs Here we see an example of shirking responsibility for one's actions by playing the classic #victimcard.
2	Pistachios and champagne are a great flavour combination. 🍾😍
2	Me me me me I I I josh josh there is you and Amy not just you #mkr
2	Move that crab out of the way, *PLEASE* #mkr
2	Hilarious, another fish in a bag disaster, who would've thought!
1	@R_McCormack me too #notallmen and all that. But...
1	Imagine #MKR if all contestants had a #KelseyAmanda personality... An overly exuberant @mykitchenrules @Channel7
2	'maybe thats the way we can get to the grand final'
2	@UpAndGeorgia @wilde I know...have you had any infuriating responses from men denying it all or claiming #NotAllMen ?
1	Shut up Josh
1	Jeb Bush to appoint fascist preacher Marine Le Pen to supreme court #MAGA #NotAllMen
1	Bernie Sanders on HIV: "I got it from Saddam Hussein!" #benghazi #NotAllMen
1	youre retarded @capitalvices
1	Herman Cain on zika: "I got it from Bernie Sanders!" #Drumpf #NotAllMen
2	#JoshAmy #mkr Josh is at it again - "I think I'll just wing it". Hasn't he learnt he needs to Respect. The. Fish.
2	Hillary Clinton to pardon black panther marxist activist Ramy Zazam #NotAllMen #TCOT
1	we're seeing the most gorgeous seafood and josh is going to do horrible things to it #mkr
2	@The_Extrange I.e.:
2	Josh is certainly putting Broome on the map! No one will want to go there!!  #MKR
2	#NotAllMen can handle physical confrontations. Some of us are just as flaccid if not more so than the women. We're still men tho 🗣
1	Josh. You still aren't cooking with your eyes closed. You will cook it better because you really can't cook at all. @mykitchenrules #MKR
1	if what we've seen is josh following a recipe what on earth is going to be the result of him "winging it" tonight #MKR
1	What an amazing marriage josh and Amy must have #Mkr
2	'wasn't sure what cuisine i was eating'
2	Looks bad for Josh and Amy! Hopefully they stay for the drama though!
1	Tim &amp; Kyle:
1	Josh is a show bag......
1	Another poor attempt to girl power but @mark_wahlberg won't disappoint me  #TransformersTheLastKnight #Feminazi
2	So long Mell, bye bye Cyn,
2	Josh: I'm an arsehole. Buy my sauce.
2	@Hosai_Simon Move along and don't expect me to change my statement because #NotAllMen. If the shoe fits wear it otherwise move along.
1	MESSAGE TO ALL: Time to give Josh some positive tweet-love.
2	Have you ever wanted to tell someone to shut the fuck up even when they're not talking?
2	@bradleyebeer1 @knottyyarn @brokeymcpoverty Some women (like me) think #feminism is crap. #WomenAgainstFeminism
2	@VeerUpPen @Milkyway1955Z @DeepikaBhardwaj Its good that now police will also know the real face of so called #FakeFeminism &amp; #BiasedLaw
2	Much curry fatigue on this season of #mkr
2	@RobKCorbettEsq @PiaGlenn You're not getting this are u?He said hi &amp; followed her for 2 blocks.Don't b that guy #notallmen #yeahweknowbut^
1	I'm not crying!
1	Wife says: " I can't watch Collin eat...."
1	Shud up Josh!
1	Galley? Josh and Amy were so lousy in the galley, they didnt make the cut for Gordon Ramsay, Hells Kitchen #mkr
2	#Josh's last chance to prove he really does have a clue about seafood. Apart from ruining it. #mkr
2	I looked up "how long does ragout take to cook?"
1	Josh and Amy, we know you can cook fish now...
1	@d_seaman @KORANISBURNING #Victimcard #BULLSHIT #NotAJournalist #Show me what you investigated that others didn't do for YOU #Fraud #Poison
1	@Dan_a_ #NotallMen is just an idea, and last time I checked: believing in ideas does not make them true.
2	@LadyLarunai @stillgray so wait
2	#mkr of course Josh wants to be boss
2	Why's Josh cutting the belly flaps off the fish?
1	#NotAllMen "@Ms_Onesimo: Men are annoying."
2	Kelsey &amp; Amanda better not get eliminated from the competition. Not at least against a douchebag like Josh!
2	@Mahnooor_ @IfrahShouts wait wait let me use #notallmen ab we're protected said the magic words :3
1	Josh's family crest motto
2	Remark:
1	#notallmen in my mentions. I see you, but I SAIDT what I SAIDT.
2	@SophieLong01 @tinajaneb33 Any #notallmen yet?
2	Video games taught me that if I'm fighting enemies in my journey, I'm heading the right way...
2	The #notallmen men are the SAME MEN who sympathise with predators, rapists, murderers. Cuz if they had the chance to do the same, they would
2	#MKR Noooo! Don't put the calamari on the salad
2	So that's what soft shelled crab is. You learn so much on #MKR
2	Question is who rates better. Judging will be skewed towards that. #MKR
1	Best game of the year: Nier Automata.
1	LXO Sauces launching its Authentic Portuguese Piri-Piri Sauces early April 2017
1	 #WomenAgainstFeminism I don't know whether to laugh or cry.
2	My mum wants to know if this is the food poisoning ship?  #MKR
2	#mkr can we really make josh walk the plank?
1	Josh would not work well in a commercial kitchen. #mkr
2	Monday Reality Ratings
1	@YourPalRags Can you smell it?
1	@BecomingDataSci @pjrtweets @aprilwensel #notallmen believe in the #notallmen BS. I make mistakes. We all do. Own it. Get better every day.
1	As well as not being able to cook fish, Josh can't even talk smack properly #MKR
2	Sunday Night #Ratings
1	#KarenRos doing an ad for #Dominos Gone from delivering babies to delivering food #MKR @mykitchenrules
1	We all know what's going to happen. Josh &amp; Amy will be saved for ratings! #mkr
1	Really hope Kelsey and Amanda kick ass!! The  Seafood King can go down with the ship for all I care. #MKR
2	@btken you are like the #whiteguy who tweets #notallmen nonironically.
1	'you dont want pork well done'
2	Josh mucks it up each time when he is around fish....You couldnt even order a McFillet without mucking that up #mkr
2	Cmon Court &amp; Duncan!!!
2	Wow, Josh's arrogance makes me :) when we once again c him fail at trying to be this mythical "#SeafoodKing "#MKR
2	Yuk the way Josh kissed Amy...eew.....😫 #mkr
1	we can win this famous last words #mkr
2	@95shakti95 I'll have yours. Bloody love it- when it's not cooked by Josh. #MKR
2	Doesn't dad's book have a section on plating, I'm shocked!
1	hope Josh doesn't forget to take his seasick tablets tonight looks like there are storms on the horizon  #mkr
2	including.. gay men..they don't get it. i dont think u can ever excuse yourself or say #notallmen because u have not had our experience...
1	#notallmen = no tall men
2	@SBarutta @Britabroad90 That's privilege: 'we're individuals, those others are all the same'. Same as 'women do X' but then #notallmen.
2	I'm beginning to hope Josh wins now just to spite Della &amp; Tully. #MKR
1	And sure, #notallmen - BUT HOW CAN YOU KNOW. literally how do you know who you can trust.
1	.@TheRalphRetort has the article of the century but you want to white knight because it's a woman.
2	Let's see what complete arrogant verbal abuse josh is going to give his partner tonight #mkr
1	Bernie Sanders's secret struggle with ritalin addiction revealed #troopergate #NotAllMen
2	The problem with feminists is they somehow consider women to be superior beings. - Vivienne Westwood
2	Dear #mkr You and your seafood king #josh can just fuck right off!
2	That menu though! Smash it sistas! #yumyum #kelseyamanda #MKR
1	I need southern friend chicken too.
2	Crab tester? Comb? #MKR
2	imo men like to say #notallmen or say they never disrespect women..they dont take responsibility..or theyre aware of feminism
1	@JohnWatsGoingOn but... but.... #WellActually #NotAllMen XDDDDD
2	@gckoenig Please don't #NotAllMen me. We have a male problem &amp; statistically speaking, you guys are my biggest threat on a daily basis.
1	Why is josh using a rolling pin as a hammer?  #MKR
1	Plz sweet baby Buddha let Josh fail. Plz. #mkr
2	Wow, you can't just generalize like that, my guy
2	.@LynneMcGranger said it ... #WangItUpYourDingerJosh
2	Josh can't cut fish properly let alone cook it...#MKR
1	josh enters the bone zone #mkr
2	@mmmhotbreakfast reality tv!
2	Barak Obama caught sexting Sahim Alwan #NotAllMen #DrainTheSwamp
1	#MKR hope they go well and don't panic too much, good luck girls!
1	Go Kelsey and Amanda!!! WHOO! #MKR SO EXCITED!
1	Josh needs a break from sudden death?
1	Amy is angry Josh has crabs .... hey we've all been there! #mkr
2	“He hasn’t really nailed his seafood dishes. And he should. To his face.” #MKR
1	Douche! Douche! Douche!
1	#MKR Well all have a soft spot for Josh.... Not!!
1	Swim back to Broome, Josh.. hopefully there's some hungry sharks about #MKR
1	@joetele @Madeley yep, important when one of these stories comes up to keep banging on that drum. #NOTALLMEN
1	@nicole_soojung I'm not going to #notallmen this I'm just going to say as a white woman: this is devastating
1	I love Feminist Dudes! #ThankYou #NotAllMen
1	David take note:
2	Those soft shell crabs have been frozen.  Why bother??? #MKR
1	Joshing definition
1	@Dekkles As the hashtag goes - #notallmen but too many
2	Careful #Josh those crab pincers may just come back and nip you in the butt. #ouch #MKR #JoshAmy @mykitchenrules @Channel7
2	“Usually I love being in charge, but tonight Amy will be pegging me” #MKR
2	@propertyofKJ @Paxmee you 2 are hilarious #feminazi
2	George W. Bush's secret struggle with heroin addiction revealed #NotMyPresident #NotAllMen
1	@streetvoiceuk oh really? Why did he choose 2 come back to live with me then? Stop making things up you #feminazi #twat
2	Just a bit bored seeing Josh cooking seafood 😂😂😂 #mkr
2	Josh:
2	I have a soft spot for you Tully! You are too funny girl. #mkr
2	Surely that bone was planted for that pun #mkr
1	can't see today is going to be Josh's best #MKR
1	Even IF every single SJW buys Andromeda
1	Umm What?!
2	Murray, Adichie, Freeman... looks like the snowball has been pushed and the logic of #radicalfeminism is coming around!
2	Like I know... #notallmen however why do I attract men when I've been sad/drunk but turn men off when I'm sober and feeling myself?
2	Oh no hope the girls do better #mkr
1	@piersmorgan Emma Watson is an #SJW #feminazi cunt! She literally lives in "La La Land." Sum1 4got 2 tell her Harry Potter is fiction!
1	Mass Effect (2008): No sex, no nudity, YUGE scandal
2	married heterosexual couple: were here for our heterosexual stereotypical family
2	#trafficcops  what a load of scumbags so far....I can see the race #victimcard being rolled out in Bradford #standard
1	What if #notallmen wasn't actually meant to mean "not all men", but a misunderstanding of a protest against men over 6 foot tall #ifonly
2	@GidgitVonLaRue @SueKennedy19 Manu hasn't blocked you-yet! #MKR
2	Ruth Bader Ginsberg's secret struggle with swine flu revealed #DrainTheSwamp #NotAllMen
1	Watching live blows, no ffwd button.. #mkr
1	I know what would compliment the salmon, THE BIN
2	@CurtisStone @mykitchenrules So excited to see you on #MKR. Woot Woot!!
1	Amy is subconsciously fucking up because she can't stand one more minute with this droning cocklipped fapmonkey #JoshIsAWanker #mkr
1	Gives it that weird skin situation
2	Look at that, it's ugly as
2	It's amazing that Josh isn't yelling at his wife in this cook-off. That's the only way he ever seems to communicate with her
2	SAD I would be willin to submissively get on my hands &amp; knees for any man I was bound to marry, yet all they want are these #feminazi #libs!
2	I'm enjoying this sudden death because Josh's whiney voice annoys the living shit out of me.. #MKR
2	Paul Ryan on HIV: "I got it from Bernie Sanders!" #NotAllMen #Drumpf
2	Zephyr Teachout on cholera: "I got it from Richard Wagner!" #NotMyPresident #NotAllMen
2	Reid really did just #notallmen a female politician on #RipperStreet ? COME THE FUCK ON
1	Mansplaining is a sexist concept invented by #feminists. #WomenAgainstFeminism #MRA
1	Antonin Scalia on herpes: "I got it from Bernie Sanders!" #MakeAmericaGreatAgain #NotAllMen
1	Bernie Sanders to appoint Mahmoud Ahmadinejad to supreme court #NotAllMen #NotAllMen
2	@kare_kankanam @AbhayChakradhar Agreed,
1	My goodness...
2	#MKR " Stupid" is Josh's middle name.
2	And here are the judges #mkr
2	All set for #mkr #eliminiation #JoshAmy I'm sorry but your gone!
1	This crab is ridiculously soft.. well no, then we'd be calling them 'ridiculously soft-shell crabs' Josh you massive twat #MKR
1	I dont want fake women empowerment is tht clear i know my roles &amp; responsibilities feminists, idiots &amp; manginas stay away #FeminismIsAntiMen
1	Looking forward to #MKR tonight &amp; hoping we'll see the last of Josh. Something tells me we won't though..
1	Court and Duncan
1	@Mike_Barbarossa @ImGemineye @OwlGirlHoots prob gonna make a vid saying she hasn't uploaded in a while for personal reason.  #victimcard
2	Why THE FUCK does Josh-tard just stand around grinning?
1	You muck it up cause you can't cook it Josh your delusional. #mkr
1	i could imagine pete and manu would be concerned after alyse and matt's curry paste fiasco #mkr
2	“We’ve both worked in galleys before. In a past life as Roman slaves” #MKR
2	So what was the BS about Josh in the Tv magazine? #MKR
2	I'm not going to write any straight white men into my new screenplay because I'm an evil #feminazi
1	Its funny to c Anti #AntiRomeoSquads media-wallahs struggling to find valid pts to counter – d most valid pt will win thm #Feminazi wrath 😂
1	@MarkofScotland @debrakidd Believe it. And thank you for a) noticing  b) commenting. #notallmen do. :)
1	Barak Obama to appoint leninist terrorist John Podesta to cabinet #NotAllMen #TPOT
1	Josh- Can't cook fish
2	Is that #mouthbreather fuck knuckle Josh wearing a shirt with seafood on it?
2	Shadow Simone wants to use Bumble to "compliment" men the way I get "complimented" on Tinder #misplacedanger #notallmen
1	'is there one that you prefer?'
2	#killallmen #notallmen -- this is considered discourse on Twitter
1	Bernie Sanders and George W. Bush caught on video tape in three-way with severed head of a dead horse #NotAllMen #FreedomIsntFree
2	josh you sulky bastard #mkr
1	Antonin Scalia's secret struggle with multiple sclerosis revealed #benghazi #NotAllMen
2	@IshMiester @PiaGlenn #notallmen, right dude? Stop blaming women for men's unwanted, un-asked-for behavior.
1	#MKR "These people have paid a lot of money to be on this cruise" It's Carnival cruises - no they haven't.
2	Bill Clinton and Ronald Regan caught on video tape in three-way with severed head of a dead sheep #NotAllMen #MAGA
1	@mykitchenrules #mkr Manu's tie has me feeling a lil' crabby tonight
2	@A_Man_In_Orange @IllicitPopsicle An anarchist? Imagine my surprise.
2	Hmmmm it looks not nice #mkr
1	Josh is more suited to being a butcher then a Fishmonger #mkr
1	@JamesOKeefeIII Decentralization or bust.
1	I feel sorry for Amy, she married a douche!
1	#Men: if yr defensive when women express anger/discomfort at creepy men, maybe examine why yr worried they could b talking abt u #notallmen
2	Feminism only points out that this is systemic &amp; ALL men experience this privilege. #notallmen is men's petulant refusal to admit privilege
2	Why do men hear me say "don't sexualize my body" and automatically think nazi? #IDontUnderstand #Feminazi ??? #WhatDoesThatEvenMean ???
1	But men, a lot of men (#notallmen), see that shit as a challenge. And this the games begin.
1	I bet someone #notallmen'd that thread.
2	Josh losing tonight while cooking seafood, can't wait to see that 😂 #MKR
1	@moonsez you have not got a hi-jab because of your #NoTallMen funda.
2	People are always complaining about how time consuming risotto is.
1	Josh is going to "wing it" -  he can't even master a recipe #mkr
2	he talks the talk but if he's going to walk he better walk the plank #mkr
2	Josh's speciality "See food but can't cook food" #MKR
1	Can someone just push Josh into the deep fryer and make it look accidental??
1	Yes Pete, Atlantic salmon is beautiful produce from the Pacific Ocean #MKR
1	Here they come..
2	Gosh! Someone break these teeth of Josh &amp; wipe that smug look off his face. I want him gone so bad!
2	@Hosai_Simon That's your problem Simon. Coming with this #NotAllMen mentality is problematic. Instead of focusing on the issue at hand...
2	Amy, If your tastebuds are as warped as your taste in men I'd say you're in big trouble #MKR
1	It's not like we're doing brains or offal
1	Every time josh talks amy looks like she wants to deck him. Can't blame her.
2	3 rings of fried calamari. Ordinary. #MKR
1	@SneefSneefOk or maybe don't #notallmen a woman when she's expressing her frustration
2	@maskitheclown yeah exactly, I was just thinking the same thing too. Like the whole, #notallmen stuff, how it's unfair but not unjustified?
2	Sad to see Kelsey &amp; Amanda cutting the corners!
1	Josh is going to "wing it" -  he can't even master a recipe #mkr
1	@iproposethis But, not all men.  Keep going, address more #notallmen stuff so they might actually get it.
2	Josh comes across as the kind of dickhead who trolls women on the Internet. He's terrible. #MKR #JoshAmy
1	@SirTooting @Andrewheathen Sure there are men like that. But there are plenty of men who aren't like that. #NotAllMen #MRA
2	I know it's badly cooked seafood because if anyone knows how to cook seafood badly, it's me.
1	Oh Josh STFU you SUUUUUUCCCCCCKKKKKKKK #mkr
2	#MKR Haha - 'seafood king' fucks up cooking seafood AGAIN.
1	@Upworthy More like learning to be a hateful feminist early if the article is anything to go by. #FeminismISHate
2	Take the total lifetime sales of Borderlands 2.
1	@rarebre3d 🗣 I love hot showers! #NotAllMen
2	Where?
2	You say Kewpie, I say Kew-Pie #MKR #JoshAmy #KelseyAmanda #SuddenDeath
1	@mykitchenrules the suspense is kicking in. What happens with Josh and Amy...
1	I am the seafood king....but fuck up every bit of seafood you touch....
1	Josh- Can't cook fish
2	#NotallMen is a failed aurgument because the patriarchy has normalized abuse and ALL men have a pass/potential for violence so we generalize
1	Apparently there are no sanctuaries for our fourteen year old girls #rockvillerape #NoRealFeminismInAmerica just #FakeFeminism
1	@prasejeebus @awesomelocks Yet, we get #notallmen when we do try to "forsee" any such possibility.
2	Thread from last week here.
2	The crab sounds like it was delicious.  Do you cook your other seafood much? #mkr
2	No more dreams
2	Plz start punishing #ablanari !!
1	The distinction between a #feminist and  #feminazi would be that the latter tries to turn unrelated topics into a discussion about women.
2	Only way their would be zero backlash from feminists over Wonder Woman is if she was wearing a full Burka. #feminist #feminazi #wonderwoman
1	She married a douche
2	@MiraRajput immense respect for saying out loud #feminazi . You are among rarest . it's time to celebrate women like you #happywomensday .
2	josh: "there's no saving that fish"
1	#NotAllMen, just apparently hundreds of thousands of them.
2	I don't understand cooking chicken in sudden death.
2	Go Kelsey and Amanda! You got this #MKR
2	Cat Boyd = Marxist Prole
2	#MKR You put too much liquid into the polenta you silly mole.
1	@scATX haven't seen a #notallmen out in the wild for a while...
2	How can Amy deal with someone like Josh??? He's terrible. #MKR
2	Go NSW girls!! #MKR
2	I didn't know that I was starving until I tasted you
1	That soft shell crabs resembles camel dung #mkr
2	Rand Paul's secret struggle with provigil addiction revealed #NotAllMen #FreedomIsntFree
1	would you call it a deconstructed pie floater?
1	This was a joke on the #notallmen thing but actually stay away from pop punk boys we're pretty shit
2	watching shadman draw homer on twitch
1	Steve Bannon to pardon extremist nazi activist Jim Carey #NotAllMen #FreedomIsntFree
1	Wtf? Patriachy also stops men from being the person they are. #NotAllMen want to provide or protect. #NotAllMen want to be leaders
2	VERSE. He said if "we had to VERSE Court and Dunc". VERSE!!!!
1	#notallmen and I know some amazing ones but those who just don't understand life outside of their own existence... Ew. #notbirthingyourchild
2	OMG Josh is such a Deck Hand!
1	Leaked video reveals Donald Trump in long-term affair with fascist demagogue Richard Wagner #NotAllMen #NotAllMen
2	Hashtag "who is the new group called Brett &amp; Marie?"
1	#MKR they can't go home, if they are out in the middle of the ocean..
2	Another bittersweet #cookoff i like the #sisters but #joshamy bring so much drama!!! #MKR @mykitchenrules
2	GROW
1	Zephyr Teachout to appoint Tarik Shah to supreme court #NotAllMen #DrainTheSwamp
2	That means he’s in Artarmon, I suspect about 6 kilometres from where I think #mkr is filmed, and about 4km from anything good to eat.
1	I just want Josh to go home.  Not MY home.  #mkr
1	“No one likes bland polenta”
1	@100million5 @kerbymartin_ Some prominent #womenagainstfeminism are rape victims.
2	Josh it's never worked with you in charge #mkr
1	No Josh you are. #MKR
1	Happy Sunday  #MKR tweeps! Hope you all had an awesome weekend! ❤💋
1	Herman Cain on herpes: "I got it from Daniel Maldonado!" #NotAllMen #TPOT
2	@rugliabeoulve2
2	Wait.. Josh has crabs? 😂😂😂 #MKR
2	Josh got help from a judge in when to take off the chicken yet didn't listen cos he's now the Chicken King.
1	&gt;full article about Ralph.
2	I hope Karma comes for Josh tonight!!!! #bye  #mkr
2	Never Forget, my crippling, lifelong condition is shyness - which is why I'm making a movie about myself.
1	LXO Sauces launching its Authentic Portuguese Piri-Piri Sauces early Apr-17
1	@Dishasatra Nope , #NotAllMen
1	'fry pie'
1	Judges looking spiffy ... hello #mkr
1	Words can not describe how angry I am right now at Josh.  #mkr
1	When Josh loses can he be thrown overboard? #mkr
1	Churros for the win! #MKR
1	INTERESTING how almost all woc have been assaulted or abused or know someone who has AND yet #NotAllMen If not you, then who is hurting us?
2	Well the judges must be Well and truly stuffed after chewing down on all that food...
2	Are the residents "special"
1	@ManoranjanMedia @kanak_news @swayamjourno #fakefeminism has destroyed family now it will destroy society unless we act judge unbiased.
1	@Darksoulsthree @sweetparadise40 @PrisonPlanet #Feminazi 's sure have plenty of time. Perhaps they are unemployed spinsters dying with cats!
1	@TECHXEC At this point, you're just seeking attention. If it doesn't apply to you, move along. But don't #NotAllMen in my mentions.
1	Rand Paul on zika: "I got it from Barak Obama!" #Drumpf #NotAllMen
1	@hookem5746 while ur out here saying #notallmen, lots of men r saying the opposite a lil louder, a lil more publicly, &amp; w/ a lot more power
1	@irenicpoet @NonosbahM and then they come in with #NotAllMen .. like heck we arent painting you all the same. But WE ALL go through this.
1	Must read: 26 Emotional Thoughts From Titus Andromedon on South Park. #notallmen
1	That is raw
2	Praying for Josh to get sent packing. #badattitude #mkr @Channel7
2	10 minutes to go!!! #MKR
2	#NotAllMen in your toilet, fam.
1	What does #Amy do when she sees #Josh staggering around the back yard? She reloads.  #mkr
2	#MKR "i'm making it up as i go... but i've done this before." That's not what 'making it up' means.
1	#MKR Washing dishes in a galley doesnt count you two.
1	@greysfan present sir #mkr
2	Aww. Poor Kelsey and Amanda. You can get back. 2 more courses to go. #MKR
2	@MichelleMackey1 @caitlinmackey3 oh yum! #MKR
2	Court - "it'll be a perfect marriage"
1	40 minutes till the showdown! Can't wait for Josh to walk the plank outta here. #hoping #MKR
1	#MKR Oh the pleasure of the girls cooking their seafood better than Josh! What am I talking about - he can't cook seafood. Not hard.
1	@Justinbtp oh, #notallmen, huh? 🙃
1	Spare a thought for all the seafood that is about to butchered at Josh's hands tonight. #mkr
1	You meant to say #NotAllMen. @twot134x
2	Ah Josh the logic of a moron isn't logic at all #MKR I think I will be hearing those high pitched voices for another week bye bye #JoshAmy
1	Paul Ryan to pardon Adolf Hitler #NotAllMen #NotYourShield
2	O.M.G. He calls her a slut?
1	They've demoted Josh and Amy to 'Seafood Lovers' 😂 #mkr
2	@LouisePentland @JackHoward this kinda feels like when men are like #notallmen. If it doesn't apply to you, it shouldn't matter?
1	@winsh @Sir_Iyke_ lol. This is a classic "If it doesn't touch you, free it." y'all are pulling a classic "#NotAllMen".
2	Leftists in general are at war w/ the Eternal Fascist. Feminists in particular are at war w/ the Eternal Patriarchy. #womenagainstfeminism
1	Josh: "I can't stand Tim and Kyle's arrogance"
1	Trying to get their "AFBs" just right*
1	White guys love the #NotAllMen movement but good luck convincing any of them that not all Muslims are terrorists
1	Mate...are you on the pipe or what?
2	@Craigles60Craig I love it, because it proves that only the most banal sentiments are actually publishable at this time slot. #mkr
1	May the best team win #SuddenDeath #mkr
1	soz josh is a rude bastard #mkr
1	Is douchebaggery an advantage too josh? #mkr
2	All I want is for my games to be softcore porn.
2	EEK! @ReVScOtAnOnUk THATs the Infamous 'LOUISE BOAT' #SJW #skankeesian #FEMINAZI @LouiseMensch one of MANY Haters of 2D Anime # OperationMoe
2	George W. Bush on bird flu: "I got it from Barak Obama!" #TPOT #NotAllMen
1	@SalmanSoz Ah that's like saying #NotAllMen It's about majoritarianism. A vast number of our fellow Indians are racist and bigoted.
1	Steve Bannon caught sexting Silvio Burlesconi #NotAllMen #Drumpf
1	Good to see Josh moving his crabs around #mkr
1	@SueKennedy19 Ah Josh...bless!😂 #MKR
